,0,1
5c94c69149f0eacbf105e795,https://www.nytimes.com/2019/03/22/arts/music/silvana-imam.html,"STOCKHOLM — On a recent Friday night, the Swedish rapper Silvana Imam appeared on stage at Annexet, a concert venue in the south side of Stockholm, dressed like a comic-book villain. Her face hidden by a black mask studded with spikes, she dragged a metal baseball bat across the stage to the loud cheers of her mostly female audience. The menacing display was a theatrical embodiment of the gleefully confrontational role Imam, the lesbian daughter of refugees, has come to play in Swedish pop culture. Imam, whose mother is Lithuanian and father Syrian, is one of the country’s best-known hip-hop artists, and a symbol of the counterreaction to the rise of right-wing populism in Scandinavia’s most populous country. When the mask came off, Imam, 32, launched into “I Min Zon” (“In My Zone”), a languid, withering song from her first EP, in which she rails against racism and sexism in the country. “Fifteen million people in the world are named Mohamed,” she rapped in Swedish, “but whose name do they want to see on the résumé?” Mattias Naxe, 30, a lighting designer in the audience, said that he was drawn to Imam’s music primarily because she was a “very good rapper,” but added that her success was also a reflection of Sweden’s polarized political climate. In last fall’s national election, the right-wing populist Sweden Democrats won 18 percent of the vote, making them the country’s third-largest party. “She came at the right time,” he said, adding that she “very much” represents this particular moment. Although Sweden is known for being one of the world’s premier suppliers of dance-pop, it also has one of Europe’s most vibrant hip-hop scenes. Imam is one of its biggest female stars. In 2014, her breakout single “IMAM,” a political song in which she refers to herself as a “176 centimeter Pussy Riot,” reached number one in the Swedish charts. Since then, she has won numerous awards, including a Swedish Grammi, the country’s equivalent to a Grammy Award, for artist of the year. Her most recent album, “Helig Moder” (“Holy Mother”), released in February, has been widely praised in the Swedish news media, and she was recently announced as the opening act for the main stage of the renowned Roskilde Music Festival in Denmark. In an interview in a coffee shop in the Hornstull neighborhood of Stockholm, where she lives, Imam said she had struggled with the pressure of her success and the fallout from her position as a political provocateur. She explained that her new album was an attempt to come to terms with the “superhero everyone wants me to be, or the one that I’ve become in Scandinavia for a lot of people.” Although Sweden is often seen internationally as a paragon of social liberalism, many of Imam’s songs have highlighted the racism, misogyny and homophobia she believes permeate society here. Her 2015 single “Imam Cobain” included a frequently quoted line instructing the men who “say my love is a crime” to “go and kiss” a “swastika.” Another song called out people offended by the fact that she is a “hybrid,” with Syrian roots. The rise of the Sweden Democrats, she argued, only goes to prove her point. The party, whose slogans include “Keep Sweden Swedish,” has its roots in the neo-Nazi movement and campaigned on severely limiting immigration. “Sweden is finally revealing itself for what it is,” Imam said. The rapper was born in 1986 in communist Lithuania, but her family moved to what was then Czechoslovakia when she was a toddler. When her father, a journalist and lawyer, came under pressure there because of his far-left politics, the family fled to Kiruna, Sweden’s northernmost city, which she described as “very cold” and “with no people of color.” After the family relocated to Stockholm, Imam attended a school in the suburbs where she said there were “neo-Nazis and immigrants, and nothing in between.” A longtime fan of the Fugees and Kanye West, she started performing while completing her degree in English and psychology at the University of Stockholm. Her anger at the far right was galvanized in 2013, when Jimmie Akesson, the leader of the Sweden Democrats, retweeted a photo of her performing at a protest against the far right while wearing a jacket bearing a crossed-out “S.D.,” the party’s initials. The song she performed included the line, “send the pigs to slaughter,” referring to members of the party. Afterward, she received threats from his supporters. “He knew what he was doing. He knew what kinds of followers he had,” she said. The debate around refugees in Sweden, she argued, has become untethered from reality. “The claim that we can’t afford the refugees isn’t fact-based,” Imam said. Tax avoidance by large companies was a bigger drain on the economy, she added. In 2015, one of Imam’s cousins was among the many thousands of migrants attempting to make their way across the Mediterranean into Europe after the outbreak of the Syrian civil war. The incident, she recalled, affected her deeply. “She sent me a photo of her boat, with just water and three sandwiches, and I thought this was crazy,” she said. The cousin and her two children ultimately ended up in Denmark. Ametist Azordegan, a radio host and producer currently writing a book about Swedish hip-hop, described Imam by phone as one of the country’s “top hip-hop artists” and one of the “absolute best” lyricists, and argued that she “has built a space for gay, young women that hasn’t existed in the media in Sweden.” Christina Tsiobanelis, one of the three co-directors of “Silvana,” a documentary about Imam’s early career that played in movie theaters around Europe, said in a phone interview that the rapper’s success coincided with not only the rise of the far right, but also the growth of an increasingly vocal feminist movement in the country. “If she had come up three years earlier, she might not have become that successful,” she said. The film, which won a Guldbagge Award, the Swedish equivalent of an Oscar, for best documentary, also chronicled the beginnings of Imam’s relationship with Beatrice Eli, a Swedish pop singer. The two remain together, and have recorded several duets. In Imam’s view, they are the country’s first prominent lesbian couple to be “cool and young.” She added, after a pause, “and hot.” At Annexet, Eli appeared on stage to perform with Imam in “Magi Som Orlando,” a sexually charged duet. They pressed into each other as the crowd cheered. Then, a few minutes later, the stage turned into a raucous celebration reflecting Imam’s cultural and sexual identities. Two belly dancers and a row of women in traditional Arab costume gyrated on the stage, while another dancer balanced on her head. Silvana jumped up and down, laughing. “Silvana is a symbol for the new Swedish girl,” said Leonora Haag, 20, who watched in the audience. “Swedish people are very much a collective, you don’t stand out. What’s amazing about her is that she just doesn’t care.” "
5ca234ad49f0eacbf1f7b22a,https://www.nytimes.com/2019/04/01/dining/madhur-jaffrey-rap-video-mr-cardamom.html,"The halal cart was shaking. Inside the hot tin box, the 85-year-old actress and cookbook author Madhur Jaffrey, masked in giant sunglasses and a rippling white wig, was hopping up and down and making profane gestures with both hands. It was Day Two of the video shoot for “Nani,” a rap song by Zohran Mamdani, a young Queens M.C. who calls himself Mr. Cardamom. The elegantly feline Ms. Jaffrey — best known for her roles in the Merchant-Ivory film “Shakespeare Wallah” (1965) and, more recently, the NBC sitcom “I Feel Bad” — was incarnating a gangster granny who refuses to submit to her son’s bleating demands for less meddling and more dutiful child care. In the video, which debuted Monday online, the character describes herself as “85 years gold” and “the best damn Nani that you ever done seen,” among other assertions too colorful for this newspaper. She is prone to slapping bothersome men on the street (who cower even as they loom over her) and insisting that restaurant maîtres d’ come grovel and refill her water glass. “It’s like playing Lady Macbeth,” Ms. Jaffrey said. “If you’re an actress, you have to play everything.” In what may be the unlikeliest pairing since Martha Stewart and Snoop Dogg, Ms. Jaffrey agreed last spring to appear in Mr. Mamdani’s video after he wooed her over a cup of chai.  “I thought, I can do this,” Ms. Jaffrey said. “Then I read the words.” She watched rap videos as research, and grew nervous. The biggest challenge: to mouth the lyrics at top speed, while staying on the beat. The song was written two years ago as a homage to Mr. Mamdani’s then 85-year-old nani (grandmother), Praveen Nair, a former social worker in Delhi, India, and a founder of the Salaam Baalak Trust, which helps underprivileged children living on the streets. “She has gone against the grain in so many different ways,” he said. This manifests in the video as a fantastical vision of her running a crime syndicate and recruiting children at Khan’s tutoring center in Jackson Heights, Queens, who are supposed to be preparing for the city’s Specialized High Schools Admissions Test. “It’s an Indian ‘I Will Survive’ kind of song,” Ms. Jaffrey said. For many in the desi diaspora, Ms. Jaffrey is a revered figure, almost single-handedly responsible for introducing the complexities of Indian food to the West, and asserting its place in the pantheon of great world cuisines. A mutual friend approached Ms. Jaffrey on Mr. Mamdani’s behalf, and she was intrigued. The two met, and he pleaded his case, then proceeded to build the video around her, weaving in clips from her movies and TV cooking shows. Mr. Mamdani, 27, was born in Kampala, Uganda, and moved to New York at age 7. In his official, buttoned-up life, he counsels homeowners facing foreclosure. But he has always had an alter ego as a musician. As a junior at the Bronx High School of Science, he ran for class vice president with a rapped platform promising freshly squeezed juices for all. He lost. Four years ago, he reinvented himself as Young Cardamom, and with his childhood friend Abdul Bar Hussein (a.k.a. HAB) recorded “Kanda (Chap Chap),” a rap about the fatty, greasy splendor of Ugandan-style chapati. (At one point in the video, the flatbread spins on a turntable.) “#1 Spice,” the duo’s biggest hit, was written for the 2016 movie “Queen of Katwe,” where it is first sung by a child in Uganda selling salt, then blasted as a full-fledged rap over the credits: “Bring the flavor to the fish, bring the flavor to the rice / Who’s the number-one spice?” (The film was directed by Mr. Mamdani’s mother, Mira Nair, whose work includes the Oscar-nominated “Salaam Bombay!”) Mr. Mamdani wanted his first solo video as Mr. Cardamom (“Better drop the act that I’m young,” he said) to be “a love letter to desi New York.” So the crew wound its way from an apartment in Parkchester in the eastern Bronx, a neighborhood home to many Bangladeshi immigrants, to Kabab King, a nostalgically dingy 24-hour diner and cabby sanctuary in Jackson Heights. “The service is horrendous, and it’s beautiful,” Mr. Mamdani said. “You can make direct eye contact with someone and they will not come to your table.” The owners let him shoot without charge. There were few frills on set. Mr. Mamdani asked a friend to arrange Ms. Jaffrey’s transportation, and was horrified to learn later that she’d had to share a Lyft from her home in Greenwich Village. “Somebody carried my shoes,” Ms. Jaffrey recalled. Between takes, she swapped recipes with the crew and offered tips on difficult ingredients like bitter gourd: “We don’t cut down on the bitterness — we think it’s good for you.” The shoot took place last May, during the holy month of Ramadan, a difficult time for a Muslim rapper to make a video celebrating food. Mr. Mamdani fasted for the first day, but couldn’t make it through the second, not with kebabs so close at hand. It took nearly a year to finish the video. Among other obstacles, one would-be editor pocketed Mr. Mamdani’s hard drive and was never heard from again. In the meantime, Ms. Jaffrey shot the first season of “I Feel Bad” (the series is awaiting renewal) and wrote a cookbook, out this May, dedicated to the pleasures of the Instant Pot. “If you follow my directions — not the Instant Pot directions — any rice comes out perfect,” she said. When Mr. Mamdani tried to pay her for her work on the video, she refused. But she kept the yellow beret he had bought as a final, Che Guevara-esque touch for her costume. Mr. Mamdani likes to imagine her wearing it every now and then, eyebrow cocked, still prowling the streets as Nani. Follow NYT Food on Twitter and NYT Cooking on Instagram, Facebook and Pinterest. Get regular updates from NYT Cooking, with recipe suggestions, cooking tips and shopping advice. "
5ca6950749f0eacbf1f8102c,https://www.nytimes.com/2019/04/04/obituaries/a-rapper-who-came-back-for-his-neighborhood.html,"Nipsey Hussle’s raps boasted of his exploits as a young man in South Central Los Angeles and the perils of becoming a gang member. But his music was also a path to a more legitimate life for him and an inspiration and exhortation to others in his situation. Hussle, who was 33 when he was shot and killed in Los Angeles on Sunday in what police said appeared to be a personal dispute, was born Ermias Joseph Asghedom in Los Angeles on Aug. 15, 1985, to Dawit Asghedom and Angelique Smith. His father is Eritrean, and Hussle had said that his name means “God will rise.” Hussle said in a 2018 interview with the Dallas radio station KBFB that he had visited Eritrea and met his relatives there in recent years and considered his African heritage an important part of his identity. “As much as I’m a black person from America, I’m a black person from Africa, too,” he said. He said he dropped out of high school after the 10th grade to focus on music. He rapped about his background, and his hope for the future, on “Blue Laces 2”: Third generation, South Central gang banging Had lived long enough to see it changing Think it’s time we make arrangements Finally wiggle out they mazes Find me out in different places But he never entirely left the streets behind, and he said he had never entirely meant to. Hussle was a member of the Rollin’ 60s Crips gang, and in the Dallas radio interview he said: “You don’t get out of a gang, truthfully. You just redirect your energy.” At the time of the interview, he was on a promotional tour after the release of his debut album, the Grammy-nominated “Victory Lap,” that February. The album was his first major-label release after he had spent years as a recognizable mixtape rapper who had not quite broken into the mainstream. He sold one mixtape for $100 to gin up publicity; Jay-Z was reported to have bought 100 copies. While he worked to come up as a rapper, he pursued other ventures that kept him tied to his neighborhood and allowed him to give back to it, like a shared work space and the Marathon Clothing, his store off Crenshaw Boulevard. (He was shot outside it.) Entrepreneurship and self-actualization were a part of his message, along with swagger and braggadocio. “I ain’t in cars going on missions no more, I ain’t in the spot,” he said in 2018. “I’m on a radio run, dropping my album, you know what I mean, building businesses, employing my homeboys, you know what I mean, and paying taxes.” His death prompted widespread mourning in South Los Angeles, as well as calls to address the violent crime that still plagues the community. “I think young people that’s really identified themselves as gang members, when you look at yourself outside of the gang, you don’t really got an identity,” Hussle said, adding that he had decided to focus on music after several of what he described as “wake-up calls.” In addition to his father and mother, his survivors include his partner, Lauren London, an actress and model; their son, Kross; a daughter from a previous relationship, Emani Asghedom; a brother, Semiel; and a sister, Samantha Smith. "
