,0,1
5c3f8c993a125f5075c04c4b,https://www.nytimes.com/2019/01/16/movies/fyre-reviews.html,"Does anybody need two movies at the same time about the same music-festival fiasco? I don’t. Yet in keeping with the excess unspooled in both, here they are anyway: two documentaries about the Fyre Festival — Netflix’s “Fyre” and Hulu’s “Fyre Fraud” — an event for which lots of young people paid lots of money and got nothing in return but international mockery. The movies have footage, guests, formal devices and sneering in common. Releasing one within spitting distance of the other is like opening a Walgreens across the street from a CVS. They’re different and the same. Even so, “Fyre” is fine. “Fyre Fraud” is better. “Fyre” hurls the swindle at its center like a bowling ball. The movie, which Chris Smith directed, finds the players in and around a 2017 scheme to pull a music festival out of thin air: software programmers, marketing people, expert event planners, laborers, the bilked. They make it clear that Fyre probably never could have been a success, and even if you know the story of how it wasn’t, nothing stops you from rooting against it anyway. It was conceived in both bad faith and bad taste, as part of a collaboration between Billy McFarland, a 20-something con man from New Jersey, the beached middle-aged rapper Ja Rule, and a fleet of Instagram influencers. [Read our inside account of the Fyre Festival.] Hundreds of people bought tickets to a party on an island in the Bahamas promoted, fictionally, as once belonging to the drug lord and murderer Pablo Escobar. They were promised a luxe weekend and got soggy mattresses instead. Each movie consists of talking-head interviews. But the meat of Smith’s movie is the footage, handsome footage — of meetings, conference calls and promotional shoots; of what happened when all those kids sought food, water and a desperate exit. You watch both movies in a kind of fascinated horror at how easy it was for McFarland to create a network of what appears to be unwitting co-conspirators to help him plan an experience that wound up losing $24 million. So many people mention how seductive and magnetic McFarland is that you also watch both movies expecting them to inspect his magnetism. To see him in Smith’s film, reveling in footage taken by other people — this chubby, gangly, awkward but not not handsome slouch who himself seems attracted to fame, power, wealth and sand — is to wonder whether those same people needed a magnet in their lives, especially one who could make them some money. “Fyre” needs another layer. You can locate in it this national moment of brashness and effrontery. (Even after McFarland has been arrested, as he was in June 2017, and released on bail, he cooks up another sham business. As you read this, he’s serving six years in prison after pleading guilty to wire fraud.) But the Hulu documentary, by Jenner Furst and Julia Willoughby Nason, does more than locate. It unpacks, analyzes and jabs. “Fyre” is an ethics thriller. “Fyre Fraud” is a behavioral farce. It has arguments to make about the insecurities of millennials and the perniciousness of social media. And the arguments don’t feel like blather. The sharpest parts of Smith’s “Fyre,” which is a co-production of Vice Studios and, apparently, Jerry Media, the marketing bros who helped sell the festival in the first place, are throwaway observations, like the one someone makes about how a single tweet of a sad sandwich demolished the image of a hot event that it took an armada of supermodels to help sell. Smith’s movie does have a devastating moment with a Bahamian woman still recovering — emotionally and financially — from the compassion she showed the Fyre flies who swarmed her poor restaurant. Both do a fine job of having Ja Rule incriminate himself on calls and in the media. But the Hulu movie is more comprehensively damning, in part because it goes farther with the cultural story and in part because the filmmakers have access to what’s missing from the other film: McFarland, who stonewalls and swivels through the tougher questions. The filmmakers reportedly had to pay him to do it. So the bad judgment extends even to the movies about the bad judgment. Nonetheless, reconstructing how Fyre burned a lot of people is not a small thing. I left Smith’s movie irked that it doesn’t attempt to show who McFarland was or to explain him as fully as it could. (His participation, paid but preferably otherwise, wouldn’t have been necessary.) I suppose it’s hard to get to the bottom of these pathological seducers. The makers of that trashy but effective new R. Kelly documentary series certainly had a hell of a time. In “Surviving R. Kelly” and Smith’s film, that void could just mean the real story is about the victims, enablers and suckers — or even about us. But when people in both Fyre movies say that they’re positive McFarland will strike again, what’s in order is the deeper, more cautionary examination of him that’s in “Fyre Fraud.” Not because that prediction is wrong. But because I wouldn’t put anything past this country. McFarland really might have another act. Maybe as a con artist. Maybe as someone more, I don’t know, elected. "
5c9e6a2649f0eacbf1065d2d,https://www.nytimes.com/2019/03/29/arts/music/playlist-sky-ferreira-lil-uzi-vert-rosalia-beck.html,"Every Friday, pop critics for The New York Times weigh in on the week’s most notable new songs and videos. Just want the music? Listen to the Playlist on Spotify here (or find our profile: nytimes). Like what you hear? Let us know at theplaylist@nytimes.com and sign up for our Louder newsletter, a once-a-week blast of our pop music coverage. The first original song Sky Ferreira has released since 2013 veers sharply away from the armor-clad pop that filled her first album. But in a way, it’s a segue from that record’s ominous (and atypical) title song, “Night Time, My Time,” by way of the latter-day “Twin Peaks”; she produced the song with the music supervisor for “Twin Peaks,” Dean Hurley. A full minute of a dirgelike string-section instrumental — keening and quivering above, pulsating below — opens “Downhill Lullaby” before Ferreira comes in, singing a chantlike verse in a low, ragged voice: “You leave me open when you hit me/No one can hear you, then you hurt me.” She announced back in 2015 that her next album would be called “Masochism”; this makes clear why. JON PARELES From 1969-72, Joseph Jefferson led a Philadelphia funk band called the Nat Turner Rebellion, which released a few singles — including “Tribute to a Slave” in 1969 — and left an album’s worth of unreleased music in the vaults of Sigma Sound Studios. The first full Nat Turner Rebellion album, “Laugh to Keep from Crying,” has now been compiled by independent archivists and music-business students at Drexel University, which received thousands of tapes from Sigma Sound as a donation. “Tribute to a Slave,” a greeting across eras to the rebel slave Nat Turner, is vintage socially conscious, tambourine-shaking funk. Amid wah-wah guitars and assertive horns, it proclaims, “We ain’t slaves no more.” PARELES Cage the Elephant and Beck made a Twenty One Pilots song. (A good thing!) CARYN GANZ Recently, Lil Uzi Vert announced online that his career was on hold, if not over. What appeared to be a disagreement with his label seemed to be imperiling the release of any new music, including the long-awaited album “Eternal Atake.” In the last couple of days, however, there’s been some movement amid the uncertainty. “Free Uzi” — which his label said was not an official release — made its way to SoundCloud and YouTube, and displayed Uzi at his frenetic best: rapping about a woman “back on my team/ ’cause my neck wet like a squeegee”; alluding to issues with his finances; and confessing to watching “The Big Bang Theory.” JON CARAMANICA Rosalía’s first release since last year’s vivid and clever nu-flamenco album “El Mal Querer” is “Con Altura,” a sweetly melodic reggaeton number featuring a tart and restrained guest verse from J Balvin. The song is impressive, and the video, by Director X, is a riot of colorful outfits, flexible dance, and the confidence that comes with knowing every step you’ve chosen is the right one. CARAMANICA “Hustle” couldn’t bang any more bluntly; it’s three minutes of tightly packed pop escalation. “Don’t hustle me,” Pink berates a guy who “took my love/mistook it for weakness.” Then she restates the line with a blunter word that radio stations and this newspaper won’t use. The swinging beat harks back to rockabilly, and so does Pink’s belted-with-a-grin vocal, but the production expects a minuscule 21st-century attention span, springing a new sound — handclaps, backup voices, gunshots, bell tones, synthetic horns — every four bars if not sooner. It’s as meticulous as it is brash. PARELES Kelly Clarkson and Pink have been working in parallel for almost two decades. In 2017, when both artists had new albums (“Meaning of Life” and “Beautiful Trauma”) they teamed for a cover of R.E.M.’s “Everybody Hurts” at the American Music Awards. Now they’ve collaborated — along with Marshmello and Ed Sheeran’s “Shape of You” team of Johnny McDaid and Steve Mac — on a classic empowerment anthem either of them could have sung. It’s from the forthcoming animated movie “UglyDolls,” in which Clarkson plays a plush toy seeking self-acceptance. Perhaps in the future this duo of powerhouse vocalists and electric live performers will seek a co-headlining arena tour. GANZ As the influence of Nigerian highlife and American funk stretched across West Africa in the 1970s, different cultural traditions found their own ways in. In Benin, Sir Victor Uwaifo became known for rendering the ekassa — a rhythm and dance associated with the coronation of a new king — as a modern sound. On “IIziegbe (Ikassa No. 70),” horns and voices call back to him from across a bed of buoyant bass drum, played on every off-beat. This is one of 12 recently dug-up tracks, all from different artists, released Friday in the latest installment of Strut Records’ “Nigeria 70” series. GIOVANNI RUSSONELLO “Put your makeup on, girl, stand up straight/Your face will take you farther than your brain”: The mother figure that haunts “Pretty Shiny Things,” the harrowing and beautiful new single from the country singer Kassi Ashton, is vicious and unapologetic. Ashton paints her with the savage acuity of Miranda Lambert and the lonely sorrow of Julie Roberts, which is to say she’s painful to listen to, but hard to ignore. CARAMANICA Bluesy, fingerpicked electric guitar, and not much else, accompanies Pink Sweats in “I Know,” from the new EP “Vol. 2.” It’s a love song with a streak of desperation — “There must a reason that you’re stealing my soul” — and with a high, mournful vocal, Pink Sweats resigns himself to obsession. PARELES This year’s carnival season in Colombia has ended, but two top Colombian bands extend the party with this collaboration that pools their strengths: deep dancehall-like growls from Systema Solar and the tart lead vocals of Liliana Saumet from Bomba Estéreo, entwined guitars that hint at both cumbia and Congolese pop, busily arpeggiating synthesizers and deep-dive bass lines, even some traditionalist Afro-Colombian drumming. “There will always be Carnival,” the song insists, working to make it true. PARELES Secret Machines, one of the best trios of the aughts, released a live album this week that was recorded in 2006 at the Garage in London. “Nowhere Again” is from the group’s thundering, ominous 2004 debut, “Now Here Is Nowhere,” but the band played it a bit poppier at this show shortly before the release of its second LP, “Ten Silver Drops.” A year later, the guitarist Benjamin Curtis left the band to focus on another project, School of Seven Bells. He died from lymphoma in 2013 and documents of his time in Secret Machines with his brother, the keyboardist and singer Brandon, and the drummer Josh Garza are very valuable. GANZ A tenacious 5/4 pulse propels “Crow’s Perch” through a slew of post-punk transformations in just four minutes: from muffled bass line through sparse, almost jazzy ballad, through brittle patterns and strangulated one-syllable vocal lines, through a briefly restrained spoken-word passage on the way to a crashing, shouting, dissonant peak. It’s math-rock confronting a world of chaos. PARELES Betty Carter was jazz’s quintessential modernist: She liked to tease and stretch a classic melody until it was almost misshapen, testing her elastic instinct against the structure of a piece. In this live recording, captured at Lincoln Center in 1992 during the heady final years of her career, Carter sings “If I Should Lose You” in duet with the young pianist Geri Allen. The accompanist treats the song with her own sense of passionate restraint, collapsing its harmonies at the center, as if to represent the song’s fraught, nearly fatalist romanticism. A record of the concert has just been released on CD by Blue Engine Records, Jazz at Lincoln Center’s in-house label. RUSSONELLO "
5cae21b049f0eacbf1f8264e,https://www.nytimes.com/interactive/2019/04/10/t-magazine/jeremy-o-harris-ye.html,
5c4b49183a125f5075c065b2,https://www.nytimes.com/2019/01/25/arts/music/playlist-j-cole-vampire-weekend-dua-lipa-daddy-yankee.html,"Every Friday, pop critics for The New York Times weigh in on the week’s most notable new songs and videos — and anything else that strikes them as intriguing. Just want the music? Listen to the Playlist on Spotify here (or find our profile: nytimes). Like what you hear? Let us know at theplaylist@nytimes.com and sign up for our Louder newsletter, a once-a-week blast of our pop music coverage. After a six-year gap, Vampire Weekend has re-emerged with a song that wraps misgivings in three-chord elation: first with folksy acoustic-guitar picking, then with gospel-rock piano and congas, later with jammy hints of the Grateful Dead. It all feels jovial until Ezra Koenig’s words register a not-so-oblique dread: “Anybody with a worried mind could never forgive the sight/Of wicked snakes inside a place you thought was dignified/I don’t wanna live like this, but I don’t wanna die.” Meanwhile, anyone seeking meditative sanctuary can click on “120 Minutes of Harmony Hall Guitar” — the opening acoustic guitars simply looping away, adding a modest drone for the second hour. JON PARELES The lyrics are cryptic, and so is the video, with images of armed men, surveillance screens, captive women and lessons in violence. But there’s no mistaking the urgency of Sam Fender’s desperate vocal, the rising refrain “He will play God” and the syncopated, reverberating guitar note that persists throughout the song, keeping things tense. PARELES Fresh from boygenius, her collaboration with Julien Baker and Lucy Dacus, Phoebe Bridgers has teamed up with Conor Oberst (Bright Eyes) as Better Oblivion Community Center, suddenly releasing a full album. It’s folk rock all the way, harking back to the Byrds, Bob Dylan and Ian and Sylvia, with shared lead vocals, intertwined acoustic and electric guitars and, often, a tambourine shaking along. Electric guitars surge and spill over in “Dylan Thomas,” as Bridgers and Oberst sing about power, entertainment and the elusiveness of truth. PARELES For this movie theme, Dua Lipa honors the plot of “Alita: Battle Angel,” a film based on a post-apocalyptic manga about a human brain resurrected as a cyborg warrior: “This is not a swan song,” she sings, “It’s a new life.” But she also ties it in to the female self-assertion of the rest of her catalog: “I won’t stay quiet,” she sings, her voice swelling, “ ’Cause staying silent’s the same as dying.” Backup chants sound like remnants of past civilizations; the beat is mechanized, cybernetic. The song puts human aspiration in electronic armor. PARELES Yes, that Snow. “Con Calma” underscores the endless cycles of borrowing that nourish pop music, messy and unlikely as they may be. In 1992, “Informer,” by the white, Canadian dancehall performer Snow, spent seven weeks atop the Billboard Hot 100. This was an outlier for many reasons, some less obvious than others — Snow had cut his musical teeth in Toronto’s Jamaican community. Over the years, “Informer” has remained, despite occasional mockery, the rare durable, credible example of a song by a white reggae performer. Now, in 2019, reggaeton titan Daddy Yankee, well into the neutralized-pop portion of his career, has built atop it a new song, which is enthusiastic and lighthearted, squeezing something just a little bit too tepid out of something which, in its day, had been the little-bit-too-tepid thing. JON CARAMANICA Agonized and serrated, the new song from Call Me Karizma revives mid-to-late-2000s Warped Tour electro-punk, blends it with emo instincts as refracted through SoundCloud rap, adds in heaping gobs of Marilyn Manson, and tops it off with, hiding in plain sight, a flicker of Yung Joc’s “It’s Goin’ Down.” CARAMANICA “Ecstasy” is an anti-manifesto from Sneaks, the singer, songwriter and producer Eva Moolchan. “I don’t wanna explain,” she whisper-sings, almost as if she’s humming to herself. But meanwhile she’s assembling blips, plinks, a buzzing bass riff, hovering electronic tones and casually intersecting vocal lines into a teasingly enticing track: she’s doing, not telling. PARELES Florence and the Machine almost — but not entirely — separate two threads of her music with a yin-yang pair of new songs. “Moderation” goes for a hand-clapping, room-shaking Motown-flavored rock-soul stomp — think Martha and the Vandellas — as Florence Welch scoffs at the whole notion of moderation in love. “Haunted House” turns inward instead. It starts and ends something like a parlor song, a piano waltz sung by Welch at her most decorous. But when the chorus arrives and she confesses “I’m not free yet,” she doesn’t hold back the buildup; moderation is, indeed, a struggle. PARELES As a collaborator and on her own, Julia Michaels has typecast herself as the queen of neurosis, and she’s true to that brand throughout her latest EP, “Inner Monologue Part 1.” In “Happy,” she sings, “Sometimes I think I kill relationships for art,” and adds, “I pay my bills with it.” A reggae-ish beat heaves and slams below her and a backup chorus joins her in her misery, but at the end, as she quietly moans “I just want to be happy,” there are crickets in the mix. PARELES A tsk-tsk masquerading as a chest puff, J. Cole’s “Middle Child” is the beginning of what he’s suggested is a coming onslaught of new music this year. The themes, however, are familiar: Cole’s love-em-but-needle-em relationship with younger rappers is present in full force. But unlike most elders, he’s also willing to paint himself as a student — hence, middle child. Which is why even though this song echoes mid-2010s Drake triumphalism (and also mentions Drake, for good measure), Cole cuts the arrogance with commitment to granular, almost mundane narrative. All tell, no show. CARAMANICA The saxophonist, flutist and bass clarinetist Eric Dolphy led just five studio sessions in his brief lifetime, yet he’s seen as one of jazz history’s great possibility-expanders — an improviser who squirreled away his masterful abilities under layers of evocative idiosyncrasy, packing his notes with more breath than they could fit, letting them bloom and quiver well beyond their natural pitch. Dolphy’s second-to-last recording session took place in New York in July 1963, with a midsize band, across two days, less than a year before his death at 36. It resulted in a pair of well-reputed albums, “Conversations” and “Iron Man,” but many assumed the complete session recordings were lost. The flutist James Newton — who had held onto a trove of tapes and papers that Dolphy left behind — recently turned them over to Resonance Records, which released 18 of the finest tracks from those 1963 dates on “Musical Prophet: The Expanded 1963 New York Studio Sessions.” Half were previously unissued, including this alternate take of “Jitterbug Waltz,” a Fats Waller classic with a frisky, twirling melody that’s oddly befitting of Dolphy. And mark the trumpeter: It’s the future jazz eminence Woody Shaw, age 18, sounding phenomenal in one of his first professional recording dates. GIOVANNI RUSSONELLO Last year’s most awe-inspiring jazz release was “Emanon,” Wayne Shorter’s three-disc masterstroke, much of which he recorded live with his quartet joined by the London Chamber Orchestra. But unless you shelled out for the full boxed set, you probably haven’t heard it yet. Now the digital wait is over — on Friday, Blue Note released the album on streaming platforms. On “Prometheus Unbound,” we hear how skillfully Shorter marshals a string section; he uses the orchestra not only to add strength and harmonic layers, but also to give his wide, intervallic leaps a new dynamic momentum. RUSSONELLO Hearing “Trio Tapestry,” the first album from this all-star group, it’s hard not to think back on Joe Lovano’s work in the Paul Motian Trio, another bass-free combo whose history was entwined with ECM Records. Like Motian’s, the new trio’s music drifts slowly into the space around it, gently filling a room with worried air. But the biggest difference between the bands is in the tumbling, unsettled piano of Marilyn Crispell and the warmer, more diatonic guitar of Bill Frisell (the third member of Motian’s trio). On “Rare Beauty,” Lovano’s trio treats his sharp modal melody with a sense of unfettered freedom, moving loosely in and out of step with each other. RUSSONELLO Que Vola brings together three Afro-Cuban percussionists — all members of the Osain del Monte Orchestra — and seven French jazz musicians. The lead single from the group’s self-titled debut is “Calle Luz,” a quick, pattering original that reshapes a rumba rhythm around its jagged, four-horn arrangement. The West African roots of rumba come through in various ways here; amid all the rhythmic and harmonic complexity, you might even hear echoes of Fela Kuti’s Africa ’70 band in the sound of the Rhodes, bass and drums. RUSSONELLO Sage Fisher, who records as Dolphin Midwives, uses loops of harp and electronic sounds, and sometimes (though not on this track) her voice, to construct tracks that evolve from ambient Minimalism to something considerably more volatile. “Junglespell” starts out pretty and vaguely Asian, with rippling, overlapping harp motifs. But halfway through, an electronic vortex takes shape, in rhythm-disrupting clusters and miniature alarm bells; a pretty coda can’t soothe everything. PARELES "
