,0,1
5caf027249f0eacbf1f82a17,https://www.nytimes.com/2019/04/11/us/nipsey-funeral.html,"LOS ANGELES — Thousands of mourners are expected to gather in downtown Los Angeles on Thursday to honor the life of Nipsey Hussle, the Grammy-nominated rapper who was fatally shot last month and whose success and commitment to redeveloping South Los Angeles made him a local hero. The funeral, billed as a “celebration of life,” will be held at the Staples Center. All tickets for the event, which were free, were claimed online within minutes of being made available earlier this week. The arena’s capacity is 21,000. Tens of thousands of fans are expected to gather around the venue, where a public memorial for Michael Jackson was hosted in 2009. The two-hour service will begin at 10 a.m. local time and will be followed by a procession from the Staples Center through South Los Angeles. Hussle, born Ermias Joseph Asghedom, channeled his upbringing and adolescence as a gang member into music that spoke powerfully to many who live in Los Angeles’ most vulnerable neighborhoods. As his star rose in recent years, Hussle brought investments and attention back to the area, earning the adoration of his neighbors and fans. Though he developed a following far beyond Southern California, his death last week struck a particularly painful chord among residents of the Crenshaw District, where he grew up. His clothing store on Slauson Avenue in South Los Angeles, The Marathon Clothing, had become a potent symbol of local success and black entrepreneurship, a theme he addressed regularly in his music. His fans clung to lyrics that melded familiar rap bombast with exaltations about self-discipline and long-term financial planning, a break from a music culture that often emphasizes flashy spending. The store transformed into a makeshift memorial on March 31 after Hussle was gunned down there over a “personal dispute,” according to the Los Angeles Police Department. The suspect, Eric Holder, was apprehended by authorities two days after the shooting. For days outside the store, fans prayed, lit candles and left hand-written letters addressed to Hussle. One of the mourners was Candace Cosey, 32, who remembers him as Ermias from their time attending Hamilton High School together in the early 2000s, a magnet school on the West Side of Los Angeles. She recalled how Hussle would sell mix CDs to her and others at school, and how he later started selling music in the neighborhood out of his trunk. She came close to tears as she pulled out a picture of him from the high school yearbook. “If you grew up here, you either knew him directly or you knew someone who knew him,” she said. Even as his career took off, Hussle remained approachable and “big hearted,” she said. As he amassed fame and wealth, he continued living modestly while making investments in businesses in the neighborhood. And he could be very generous. When a colleague passed away several years ago, Ms. Cosey approached Hussle’s team to see if he could help with the funeral expenses. He contributed several thousand dollars, she said. “He was about uplifting us. He hired people from the neighborhood who wouldn’t have had a job otherwise. He took care of so many people, and he invested in what he believed in, here, because he grew up here,” she said. “We have to keep that work going. It’s what he was about.” [Read more about the community’s reaction to Hussle’s death.] Hussle’s death has drawn attention far beyond the Crenshaw District. Celebrities and political leaders across the country have offered their condolences to Hussle’s family and friends. In an interview last week, Mayor Eric Garcetti of Los Angeles praised Hussle’s contributions to South Los Angeles, a community that he acknowledged has been historically overlooked by the city’s political establishment. Mr. Garcetti said Hussle embodied the very idea of black entrepreneurship, a critical component of lifting the community and its residents. “He represented redemption and hope. He had come from the world of gangs and gotten out,” he said. “This is a devastating shock to the stomach. He was really ambitious — he wanted to get African Americans into tech, on top of his music game, on top of his businesses.” “Then to be killed in such a clichéd way, by guns, for a beef in South L.A., it feeds into too many stereotypes,” he said. Velma Sanders, 60, said she did not listen to Hussle’s music but, as a lifelong resident of South Los Angeles, she felt pride watching his career grow in recent years. His presence, she said, was felt by everyone. “He would be out here. He showed you that he didn’t fear where he grew up. He was proud of it,” she said. “He was building up this community, giving back to this community. He took that money and instead of buying something luxurious, a big home or whatever, he put it back in his community so these would not be vacant buildings. It’s just beautiful.” [Read an assessment of Hussle’s music and its place in hip-hop.] Manuel Pastor, a professor of American studies and ethnicity at the University of Southern California who has researched the demographics and culture of South Los Angeles, said Hussle’s killing “felt like a kick in the stomach.” He described Hussle as “a hometown guy lifting up his hometown.” Nothing illustrated this more, he said, than when Hussle and his girlfriend, the actress Lauren London, posed for a photo shoot in GQ in February at locations around South Los Angeles — not Hollywood, not downtown Los Angeles, not New York. “This really hit hard. This was a hometown guy who stayed home,” said Mr. Pastor. Mr. Pastor said Hussle had left the gang life but never rejected the culture of the community. Alienation and the search for identity amid violence and poverty often feed into gang culture, something Hussle spoke about openly. “He did what many people ask of black celebrities, to come back to their community,” said Najee Ali, an activist in South Los Angeles who knew Hussle. He said the community is accustomed to feeling left behind when one of its own makes it big and finds fame. “They all leave,” he said. “Hussle was the only one to stay in the community. He believed in the slogan, ‘Don’t move, improve.’ That’s what made him special.” Hasani Leffall, 35, who knew Hussle, once worked for the rapper’s stepfather at a South Los Angeles restaurant called Bayou Grille. To emphasize the depth of feeling over Hussle’s murder within the black community of Los Angeles, he mentioned the murders of Tupac, Biggie Smalls, even Malcolm X and the Rev. Dr. Martin Luther King Jr. Even with his fame, money and the support of the community, Hussle couldn’t escape the violence of the streets he rapped about. Mr. Holder, the suspect in the killing, is an aspiring rapper who knew Hussle when he was younger. Mr. Holder, Mr. Leffall said, “represents a dark side about L.A., and a dark side about just men in L.A., in Crip life. There’s always somebody that just doesn’t like you, doesn’t like the fact that people love you.” "
5ca229c149f0eacbf1f7b211,https://www.nytimes.com/video/us/100000006439362/nipsey-hussle-los-angeles-mourns.html,
5cb4c71149f0eacbf1f8444d,https://www.nytimes.com/2019/04/15/arts/music/khalid-free-spirit-billboard-chart.html,"Khalid hit No. 1 on the Billboard 200 this week, bumping Billie Eilish from the top slot. Khalid, who was nominated for five Grammys last year, including best new artist, reached No. 1 on Billboard’s album chart for the first time with his second album, “Free Spirit” (Right Hand Music Group/RCA). It sold 85,000 copies as a full album in the United States — helped by a bundling deal that included it with the cost of concert tickets — but also performed well on streaming services, with 147 million streams last week, according to Nielsen. That added up to the equivalent of 202,000 album sales. Eilish, the 17-year-old singer and songwriter who made a splash on last week’s chart, was bumped to No. 2 with “When We All Fall Asleep, Where Do We Go?,” and Nipsey Hussle’s year-old “Victory Lap,” which re-entered the chart last week after the rapper was killed at age 33, fell one spot to No. 3. Also this week, Ariana Grande’s “Thank U, Next” is in fourth place, Juice WRLD’s “Death Race for Love” holds at No. 5, and Sara Bareilles’s “Amidst the Chaos” opens at No. 6. Lil Nas X’s song “Old Town Road” holds at No. 1 on Billboard’s Hot 100 pop singles chart, with record-setting streaming numbers. The track, which now includes Billy Ray Cyrus in a remix version, was streamed 142 million times in the United States last week, according to Nielsen. That easily beat the 116 million streams Drake had for “In My Feelings” last July, and it is also nearly four times as many as the No. 2 song on this week’s chart, “Sunflower” by Post Malone and Swae Lee, which had 36.5 million. But “Old Town Road” is still not on Billboard’s Hot Country Songs list, after being removed last month for being insufficiently country. One big reason: The song is largely being ignored by mainstream country radio stations, although it is on many country-themed playlists on streaming services. "
5c3bd0eb3a125f5075c0432a,https://www.nytimes.com/2019/01/13/arts/music/super-bowl-halftime-maroon-5-travis-scott-big-boi.html,"The N.F.L. on Sunday ended months of uncertainty by officially announcing Maroon 5 and the rappers Travis Scott and Big Boi as the lineup for this year’s Super Bowl halftime show. In an indication of how fraught the debate around the high-profile performance has become, Scott released a statement on Sunday announcing that he and the N.F.L. will partner on a $500,000 donation to the social justice group Dream Corps — a move that seemed to be aimed at stemming a backlash from groups that have criticized the football league’s policies. Sources familiar with the N.F.L.’s Super Bowl plans had confirmed the rock band Maroon 5 as the headliner as long ago as September, and Scott emerged last month as a reported addition to the Feb. 3 halftime performance at Mercedes-Benz Stadium in Atlanta. Big Boi, the newest name on the bill, is a member of the Atlanta rap group Outkast. But the run-up to this year’s halftime announcement had turned into a skirmish over sports and politics, as artists and others criticized the N.F.L. over its treatment of Colin Kaepernick and other players who have taken a knee during the national anthem in protest of racial injustice. In February, the rapper Cardi B, who was featured on Maroon 5’s hit “Girls Like You” last year, told the celebrity news website TMZ that she would consider performing at a halftime show “when they hire Colin Kaepernick back.” In a song released last June, Jay-Z rapped, “I said no to the Super Bowl, you need me, I don’t need you.” Scott’s involvement, specifically, has prompted criticism from some. In an interview with TMZ, the Rev. Al Sharpton said he thought Scott “should do what a lot of other major artists have done — say, ‘I’m not going to participate.’” “You can’t fight against Jim Crow and then go sit in the back of the bus,” he added. In a pair of tweets, the rapper Meek Mill responded to the news that Scott would be performing with, “For what????” and “He don’t need that he on fire already!” And Gerald Griggs, first vice president of the Atlanta chapter of the N.A.A.C.P., told The Guardian that the chapter had contacted artists and asked them not to perform. “The majority of artists we’ve reached out to are standing in solidarity against the N.F.L.,” Griggs said. “They do not want to be associated because of the protest that was started by Mr. Kaepernick against racial injustice and police brutality.” For his part, Van Jones, the president of Dream Corps and a founder of the group, celebrated the announcement in a post on Twitter, addressing Scott by his handle. “This is great news!” Jones wrote. “Welcome, @trvisXX. Glad to have you with us, brother!” "
5ca78c2b49f0eacbf1f81370,https://www.nytimes.com/2019/04/05/business/media/lil-nas-x-billy-ray-cyrus-billboard.html,"Booming beats. A twanging banjo. Is this country music? When Lil Nas X, a young black hip-hop artist from Atlanta, created the surprise hit “Old Town Road,” he did not imagine that it would end up at the center of a debate on race, the Nashville establishment and musical genres. The track marries a beat familiar to hip-hop fans with acoustic sounds and lyrics filled with cowboy imagery. Lil Nas X had no record deal when he made it, and the song bubbled up on the internet before it made three different Billboard charts: the Hot 100, Hot R&B/Hip-Hop Songs and Hot Country Songs. Once it was a success, Billboard removed it from its country chart. On Friday, in what seemed to be a dare to Billboard and Nashville, Lil Nas X released a new version of the song that included the 1990s country star Billy Ray Cyrus as a featured vocalist. Was it country enough for them now? When Billboard banished “Old Town Road” from the country chart, it issued a statement to Rolling Stone claiming the song “does not embrace enough elements of today’s country music to chart in its current version.” With Mr. Cyrus along for the ride, it is possible that country radio stations who ignored it will start playing it. [Listen: Lil Nas X and the long history of country-rap.] Billboard’s decision to drop the song from Hot Country Songs prompted a debate about race and country music itself. White Nashville artists, like Florida Georgia Line and Sam Hunt, have used hip-hop-influenced beats and production techniques for years. Do those performers have more leeway than Lil Nas X? Shane Morris, a former record label executive in Nashville, thinks so. “They said there were compositional problems,” Mr. Morris said of Billboard’s chartmakers, “because they didn’t know how to justify it any other way without sounding completely racist.” Charles Hughes, the director of the Lynne & Henry Turley Memphis Center at Rhodes College, called Billboard’s decision “a bad move,” saying it perpetuated a longstanding racial tension in black music. “Black artists have been influential in country a long, long way back,” Mr. Hughes said, “but country has rewarded white artists that have taken advantage of those influences, without giving black artists the same opportunities.” The rejection of “Old Town Road” by the country establishment, in Mr. Hughes’s view, echoed a time when country radio stations ignored Ray Charles’s groundbreaking 1962 album, “Modern Sounds in Country and Western Music.” Lil Nas X, whose real name is Montero Hill, said he wrote “Old Town Road” last fall, after staying with his sister while avoiding his parents as a college dropout. When his sister finally sent him on his way, he imagined his future. “I felt like a loner cowboy,” he said. “I wanted to take my horse to the Old Town Road and run away. The horse is like a car. The Old Town Road, it’s like a path to success. In the first verse, I pack up, ready to go.” He posted the song online in December along with an observation: “country music is evolving.” It soon became a sensation on TikTok, an app that allows users to make and share short music videos. Young people made video shorts of themselves dressing up in cowboy gear, using the song as a soundtrack. By March, Lil Nas X had nailed down the deal with Columbia. In an interview on Friday, he sidestepped questions about being dropped from the country chart. “I’m still in Billboard — this is amazing,” he said. This week, the song climbed 17 spots, to No. 15, on Billboard’s Hot 100, which measures the popularity of pop songs. The blending of country music and black American forms is certainly nothing new. The white guitarist Jimmie Rodgers, whom many consider the father of country music, built the genre on a foundation of the blues in the 1920s. Ray Charles’s innovations in the early 1960s paved the way for the Nashville success of another black artist, Charley Pride. More recently, Darius Rucker, of the rock band Hootie and the Blowfish, had a No. 1 country hit with “Don’t Think I Don’t Think About It.” Last year, Jimmie Allen, a black performer from Delaware, made Billboard’s country top 10 with his debut single, “Best Shot.” Another African-American singer, Kane Brown, had two No. 1 hits on Billboard’s country chart, one in 2017 and one in 2018. In a statement, Billboard said that its chart decisions were determined by factors including the promotion of a song and its reception at radio and on streaming services, and that it could revisit its decision about “Old Town Road.” So far, the song has gotten little support from country stations. Last week, it was played five times on country stations, according to Nielsen; this week, it was played 62 times by 31 stations. The remixed version of “Old Town Road,” with vocals from Mr. Cyrus, the singer of the 1992 hit “Achy Breaky Heart,” came together two weeks ago, Lil Nas X said. The finishing touches were added on Thursday night, hours before it was released and went viral all over again. The rapper’s collaboration with Mr. Cyrus, the father of the singer Miley Cyrus, may seem unlikely, but Lil Nas X said he had been a fan for years. In December, two days after the song’s initial release, he posted a message on Twitter asking for Mr. Cyrus to join him on the track: “twitter please help me get billy ray cyrus on this.” While the addition of Mr. Cyrus may help the song’s chances on country stations and country charts, the new version makes no substantial change to its core. Mr. Cyrus defended the country bona fides of the original version of “Old Town Road” on Wednesday, adding to the pressure on Billboard and the Nashville establishment by casting Lil Nas X in the role of a beloved country music archetype — the outlaw. “When I got thrown off the charts,” Mr. Cyrus wrote on Twitter, “Waylon Jennings said to me ‘Take this as a compliment’ means you’re doing something great! Only Outlaws are outlawed. Welcome to the club!” "
5c61b4fb3a125f5075c091cd,https://www.nytimes.com/2019/02/11/arts/music/a-boogie-21-savage-billboard-chart.html,"It was a very quiet sales week in the music industry ahead of the Grammy Awards on Sunday night. With no major releases, and no debuts making it to the Top 15, the Bronx rapper A Boogie Wit da Hoodie’s “Hoodie SZN” (Highbridge/Atlantic) returned to No. 1 for its third nonconsecutive week atop the Billboard chart. Driven by steady streams, the album moved a total of 47,000 equivalent units, according to Nielsen Music, combining 68 million digital on-demand song plays and just 398 in traditional sales — a record low in sales for a No. 1 album, beating its own bottom-water mark of 823 from last month. (Neither of the album’s trips to No. 1 in January came during its debut week on the Billboard 200, a rarity on today’s charts.) “I Am > I Was,” the former chart-topper by the Atlanta rapper 21 Savage, climbed back to No. 2 from No. 8, following his arrest on Super Bowl Sunday by Immigration and Customs Enforcement agents. 21 Savage, whose album added another 40,000 units — with just 839 in sales — in its seventh week out, remains in ICE custody and is facing potential deportation proceedings because the government says he is in the United States illegally. Future’s “The Wizrd,” another recent No. 1, fell one spot to No. 3 this week, with 51 million streams and 1,600 in sales for a total of 40,000 units, while Travis Scott’s “Astroworld” is No. 4 in its 27th week on the chart. The soundtrack for “A Star Is Born,” another chart fixture in recent months, is No. 5 with 38,000 units as the film and album continue their path through awards season. Business should pick up next week: Ariana Grande, who has had two No. 1 hit songs so far this year, released “Thank U, Next,” her second album in six months last Friday, and is poised for another blockbuster debut. And then there’s the Grammys stimulus, which could lead to sales bumps for Sunday night’s stars, like Kacey Musgraves, Brandi Carlile, H.E.R. and Cardi B. Musgraves won album of the year for “Golden Hour,” which peaked at No. 4 last April. "
5c5480fb3a125f5075c0796e,https://www.nytimes.com/2019/02/01/arts/music/super-bowl-atlanta-rap-concert.html,"ATLANTA — “Welcome to Atlanta, out-of-towners!” the hip-hop carnival barker Lil Jon screamed to a full arena on Thursday night, as he baptized the Super Bowl weekend crowd with a torrent of regional hits. It was the halftime show that never could be — a charmingly slapdash, nearly five-hour profane parade of local heroes and of-the-moment aspirants that represented a specific place and point of view too hot for an audience north of 100 million. Though the annual mid-game concert, which lasts fewer than 15 minutes, is rarely tied to the Super Bowl’s location, this year’s choice of a headliner — the anodyne pop band Maroon 5 — has proved controversial on two fronts: First, for its lack of fealty to the host city’s constantly regenerating pool of black musical talent, and also because of reports that more au courant stars turned down the N.F.L. in solidarity with Colin Kaepernick. (The late addition of the rappers Travis Scott and Big Boi, of the Atlanta duo Outkast, did little to quell the consternation and head-scratching given the three acts’ obvious incongruity.) [Never miss a pop music story: Get our weekly newsletter, Louder.] Still, Atlanta has shown itself to be more than willing to make the most of the festivities. On Thursday, at the first night of the Super Bowl Music Fest at the State Farm Arena downtown, the city’s hip-hop royalty came together for a reverse-chronological survey of Atlanta music this century, from Lil Baby, 21 Savage and Migos to Ludacris, Jeezy and T.I. (The Music Fest concerts were scheduled to continue with more Super Bowl-esque lineups on Friday, with Post Malone and Aerosmith, and Saturday, featuring Bruno Mars and Cardi B.) Though the event was temporally and nominally linked to the N.F.L. — and came with a bevy of corporate sponsorships — football felt like an afterthought, and the crowd booed when periodic commercials for the league interrupted the music. Instead, the concert felt like the celebration of Atlanta that was unlikely to happen on Sunday. And it was part of a constellation of local events, many overseen by the Atlanta Super Bowl LIII Host Committee, that sought to highlight the city’s rich cultural past and present, including six nights of free, genre-spanning concerts at Centennial Olympic Park. (There were no shortage of unofficial parties, after-parties and after-after parties, as well, with many local artists packing multiple appearances into each night.) “I’m not going to say anything bad about Maroon 5 — I love Maroon 5,” said Maya Neguse, a 20-year-old student, as the concert began. “It’s just that they’re not lit enough for the Super Bowl.” Indeed, the arena was ready to move, responding with special enthusiasm to dance crazes that originated locally (“Swag Surfin,” “Crank That (Soulja Boy),” “Laffy Taffy”) and regional references. “If you went to Freaknik make some noise,” said Big Tigger, the night’s occasional M.C., at one point, referring to the storied black college spring break gathering. “If your mama went to Freaknik make some noise,” he added to much louder cheers, revealing the plethora of what he called “’90s babies” in the audience. The night’s performances also served as a genealogical chart for the local scene. Shorter sets from the current princes of Atlanta, like 21 Savage, Lil Yachty and Lil Baby, gave way to a fuller performance by their relative elders in Migos, who welcomed to the stage everyone’s godfather, Gucci Mane. (The most notable absences of the night were from the in-between micro-generation: Future and Young Thug.) Then came the foundational contingent — the artists who might actually be able to hold down a Super Bowl stage if Southern hip-hop could crystallize into classic rap, à la classic rock. Lil Jon, who went from crunk pioneer to EDM conqueror and is now 48, played both rapper and D.J., delivering his well-worn chants — “Get Low,” “Neva Eva (Get On My Level)” — and those of his contemporaries in Crime Mob, Ying Yang Twins and YoungBloodZ. Ludacris, the headliner, also stuck to greatest hits and demonstrations of local unity, beginning with the anthemic “Welcome to Atlanta” and a brief cameo by Jermaine Dupri. After running through the most recognizable parts of his catalog with a full band — the first of the night — Ludacris welcomed the concert’s only female performer, Ciara, who did her best to supply feminine energy with some two dozen backup dancers. From there, as the clock passed 1 a.m., Ludacris was joined by Jeezy (formerly Young Jeezy) and, eventually, T.I., for a brief foray into their proto-trap music. The three men, seemingly mellowed by age and success, stood shoulder to shoulder performing the 2005 song “Bang,” which warns outsiders to mind local Atlanta customs. “When you come this city, just know,” T.I. said as the track ended. “It’s us.” "
