,0,1
5c92753e49f0eacbf105e1b8,https://www.nytimes.com/2019/03/20/arts/music/christian-scott-atunde-adjuah-ancestral-recall-review.html,"Back in the 2000s, before social media’s impact had played out, when it wasn’t yet obligatory for artists to turn their work into a political statement, the trumpeter Christian Scott aTunde Adjuah was already using music to envision change. He rarely used vocals, but Mr. Scott wrote directly from his experiences growing up in the Upper Ninth Ward of New Orleans, and from his investigations into the history of race in America. His music combined musical legacies and pushed well beyond the standard approaches to contemporary jazz; on songs like “K.K.P.D.” and “Dred Scott,” he was projecting something like a new vision for American society. So “Ancestral Recall,” Mr. Scott’s bold new album, is only one link in a long chain of ambitious, broad-minded work. And while it may not be his most immediately affecting album (that remains “Yesterday You Said Tomorrow,” from 2010), it offers the kind of slow-burning immersion that most of his recent records have only gestured at. His main goal when making “Ancestral Recall” was to remind listeners that musical traditions centered on rhythm (African and Native American traditions in particular) have as much nuance and complexity as those built primarily around harmony (read: European). Across the album, Mr. Scott lets rhythms from West Africa and the Caribbean and New Orleans — from the pre-Columbian era, the 19th century and today — lace in and out of one another. At key moments, the poet Saul Williams interjects with lines of imagistic poetry, wandering from speech to rap to song in a style similar to that of Yasiin Bey (formerly Mos Def). On the title track, he intones: Up from the water I was drowned.The bullet exits the body.The organs seal themselves.The planes appear out of fire.The people are praying right there where we left them. While he is saying this, Mr. Scott surrounds him in beaming trumpet lines — declarative though unresolved — as if heralding the arrival of a new regime. There have been two major stages of Mr. Scott’s career — among the most high profile in jazz today. From 2007 to ’12, he released three studio records that wriggled smartly away from genre concerns. Thanks in part to their drummers, Marcus Gilmore and Jamire Williams — each of whom had his own way of reconstituting the influence of Tony Williams — the songs on “Anthem,” “Yesterday You Said Tomorrow” and “Christian aTunde Adjuah” tumbled into your ear with the writhing, essential force of a feeling, or a mass of people on the move. Since 2015 he has placed a new emphasis on patterned, polyrhythmic drumming, using a tightened-up approach and more explicitly melding the sounds of modern hip-hop with ancient, diasporic rhythms. His output of the past five-plus years have been defined by Mr. Scott’s interplay with the flute of Elena Pinderhughes and the latticework drumming of Corey Fonville — both of whom first joined the band on 2015’s “Stretch Music” (a highlight), and who appear on “Ancestral Recall” — as much as by its conceptual aspirations. The new album unifies the winning elements of Mr. Scott’s past work: the historical syncretism, the tensile band energy, the powerful physicality. The first track, “Her Arrival,” begins with a group of percussionists playing hand drums and a babble of voices rising up. It sounds like a street scene, and it’s an early indication that this will be music of embodiment. You can nearly walk around inside it. Midway through the album, on the graceful “Overcomer,” a slapping drumbeat disappears early in the track and a pastel silence takes over; then a mist of harmonizing voices comes in, with a cajón, an Afro-South American percussion instrument, being pounded below. When Mr. Scott takes a solo, his trumpet starts at a whisper and grows more distorted. Soon he’s alternating between spinning thick twirls of blues, à la Louis Armstrong, and pelting spears like Hugh Masekela. Mr. Scott is not a collegiate-sounding trumpet player, and he plays with as much deference to New Orleanian and continental African traditions as to bebop. As a result, he plays fewer notes than most jazz trumpeters today, and his projection is more immediately majestic. He is following a path of his own, and so far, it’s still breaking new ground. "
5ca4f79849f0eacbf1f80a6f,https://www.nytimes.com/2019/04/03/arts/music/khalid-free-spirit-review.html,"With his 2017 debut, “American Teen,” Khalid (whose last name is Robinson) arrived as a teenager from El Paso, speaking for fellow teens, with a peer group of “young dumb broke high school kids” — a little proud, a little humble and mostly just dazedly matter-of-fact. With his long-breathed croon floating over unassuming low-fi production, he sang about circumscribed but smartphone-connected lives, misfiring romances and looming life choices. The immediacy of his melodies, the Everyteen sensibility of his lyrics and the direct yearning in his voice quickly found a wide audience. More than a billion streams, five Grammy nominations (though no wins) and a 2018 EP (“Suncity”) later, Khalid’s second full-length album, “Free Spirit,” grapples with a more singular, more isolated experience: coming to terms with fame, wealth, broader horizons and lingering insecurity. “Is this heaven or Armageddon?” he wonders in “Free Spirit.” He has moved from “we” to “I.” The music cushions his unease. It’s a generous album — 17 songs — that rolls along smoothly for nearly an hour, one leisurely midtempo groove after another, while Khalid’s voice conveys far more longing than agitation. He has upper-echelon producers now (among them John Hill, Digi, Charlie Handsome and Hit-Boy), and he’s separating himself from the twitchy, narrow-band approach of the SoundCloud rap crowd. He’s also learning from R&B’s more distant past. On the new album, Khalid embraces a fuller sound that often harks back to the 1980s and 1990s, with pillowy synthesizers, tickling guitars and multiple layers of his own vocal harmonies. In “Self,” Khalid strives to balance self-doubt — “The man that I’ve been running from is inside of me” — and self-preservation; the track, produced by Hit-Boy, lurches forward on a boom-bap beat and surrounds Khalid with glimmering keyboards and echoey vocals. In “Twenty One” — his current age — Khalid woos someone while he confesses his own turmoil: “I’m in pain/But I’m to blame/To end this fight/I have to change.” Yet there are handclaps, pop-rock guitars and layered vocals to bolster him and make sure he gets through. Success hasn’t made Khalid sleazy or arrogant. He doesn’t take partners for granted; he also understands the pop potential of respectful flirting. “Talk,” produced and co-written by the English duo Disclosure, is a male analogue of Janet Jackson’s “Let’s Wait Awhile,” telling an eager partner that slowing things down a little will bring them closer. “Can’t we just talk/figure out where we’re going,” Khalid requests, ever so politely, as syncopated synthesizers tick and blip around him. “Better,” which includes production by the Norwegian duo Stargate, celebrates the sensual bliss of a secret affair: “Just hold me in the dark/No one’s gotta know what we do,” he urges, amid floating piano chords and a swirl of his own naturalistic and sampled vocals. “Nothing feels better than this,” he exults. But Khalid can’t stay cocooned in romance. For much of the album, he’s out on his own, coping with internal anxieties and external pressures. On “American Teen” he had high school classmates who shared his fun and frustrations; on “Free Spirit,” they’ve been replaced by business associates with their own motives. “Bad Luck” glides along on gently ticking drums and a lacework of guitars, distantly suggesting Marvin Gaye’s “Sexual Healing,” yet it’s anything but reassuring. All Khalid sees around him is shallowness and duplicity: “No one really means it when they’re wishing you well/I got no one to call, no one/and people only love you when they’re needing your wealth,” he sings in a sweet, sad falsetto. And in “Hundred,” he marches through countless obligations and glances at the dubious “friends” who surround him: “Everybody wants a favor, everybody needs me/But I’m too busy trying to fight away all of my demons.” He doesn’t conquer those demons on “Free Spirit”; nor does he succumb to them. Instead, he suspends them in melody and rhythm, recognizing them and staring them down. He doesn’t pretend to be a hero or an antihero — just a young man alone, trying to get through life with some honest grace. "
5c71a2dd3a125f5075c0b328,https://www.nytimes.com/2019/02/23/arts/r-kelly-bond.html,"CHICAGO — One was a teenage fan who sought R. Kelly’s autograph during his 2008 child pornography trial. Another was his 24-year-old hairdresser. According to documents released by prosecutors on Saturday, Mr. Kelly grabbed her by the head, tried to force her to perform oral sex and then ejaculated on her, leaving his DNA. A third victim, prosecutors said, was a girl Mr. Kelly met at a restaurant during her 16th birthday celebration. Her mother was concerned about Mr. Kelly’s interest, so he helped her navigate around her parents. According to prosecutors, he instructed the girl to take a cab to his studio after her father had dropped her at school. There, he gave her an envelope with “a large sum of money” and they began a once-a-month sexual relationship that lasted for about a year. In revealing details of their case at a bond hearing in Chicago on Saturday, prosecutors portrayed Mr. Kelly as a man who repeatedly used his fame to draw girls and women into his orbit, and then turned them into targets for his sexual gratification. After surrendering Friday to face 10 counts of aggravated criminal sexual abuse involving four women, three of whom were minors at the time, Mr. Kelly, 52, was ordered held on Saturday on a $1 million bond. He did not make bail on Saturday, and “it looks like he will be at the jail for the night,” according to a spokeswoman from the Cook County Sheriff’s Office. He also had to surrender his passport and was told not to have contact with any of the alleged victims or anyone under the age of 18. “We’re happy to turn in his passport,” said Mr. Kelly’s lawyer, Steven Greenberg. Alluding to the song that made Mr. Kelly a superstar, “I Believe I Can Fly,” the lawyer added, “Contrary to the song, Mr. Kelly doesn’t like to fly.” Mr. Kelly, whose full name is Robert Kelly, did not enter a plea, though his lawyer has claimed that the women testifying against him are liars. On Saturday, Mr. Kelly stood at the front of a packed courtroom in a black hooded sweatshirt and athletic pants, holding his hands behind his back, before he was led away. Mr. Kelly has been through the court system before, in a highly publicized child pornography trial that stemmed from a video that prosecutors said showed him having sex with, and urinating on, an underage girl. Several witnesses identified her, but the girl refused to testify and Mr. Kelly’s lawyers argued that her identity could not be known for certain. He was acquitted on all counts. Kim Foxx, the Cook County state’s attorney, said on Saturday that one of the four women in the new cases is that same girl. There is no indication she has changed her mind about testifying, but the documents released on Saturday say that prosecutors have a new videotape showing the girl having sex with Mr. Kelly and making reference to being 14 years old. The tape, about two decades old, came from someone who had once been in contact with Mr. Kelly. That person recently gave the tape to Michael Avenatti, the celebrity lawyer, who turned it over to prosecutors in Ms. Foxx’s office. According to Mr. Avenatti, the acts depicted in the tape were different from those at the center of the 2008 case, eliminating any issue of double jeopardy. The girl who sought Mr. Kelly’s autograph during his 2008 trial, identified in the court papers as J.P., matches the description of a woman, Jerhonda Pace, who first told her story publicly in a 2017 BuzzFeed article by the music journalist Jim DeRogatis, who has been chronicling accusations against Mr. Kelly for nearly 20 years. According to the documents, they began a sexual relationship several months after she had sought his autograph. They had sex multiple times over the course of nine months, when she was 16, the documents allege. She told BuzzFeed that she left Mr. Kelly after he slapped and choked her during an argument. She had saved a shirt that Mr. Kelly had ejaculated on, according to the documents, and turned it over to the authorities. Mr. Kelly has been accused several times in the past of sexually abusing underage girls, but he reached settlements with nondisclosure agreements that for many years served as a protective shield. Ms. Pace broke her nondisclosure agreement, according to BuzzFeed, and her account, along with another article describing how Mr. Kelly kept women in an apparent sex cult, was the beginning of a fresh round of coverage and public outrage. Many of the allegations were chronicled last month in a six-part Lifetime documentary, “Surviving R. Kelly,” which emboldened Chicago prosecutors to try to build another case against him. Ms. Pace was in the courtroom on Saturday. The day before, after the charges were announced, she made a statement on Twitter: “To everyone that called us liars and shamed us, keep that same energy. R. Kelly is going down, DOWN.” Also in the courtroom, looking on from the row reserved for Mr. Kelly’s family and friends, were two women, Joycelyn Savage and Azriel Clary, whose presence served as a strong statement from Mr. Kelly. Their families have said the women are being held captive by Mr. Kelly, but his lawyer has said they are living with him willingly, and local authorities who have conducted checks at the parents’ behest have not found anything illegal with the living arrangement. Ms. Clary’s parents were also in the courtroom on Saturday. Their daughter did not acknowledge them. Another alleged victim, identified in court documents as H.W., met a 32-year-old Mr. Kelly at a restaurant in 1998 while she was celebrating her 16th birthday. Prosecutors say Mr. Kelly’s manager gave her the singer’s business card with his personal phone number written on it and told her to call him. Her mother, who heard the exchange, took the card away and told Mr. Kelly’s manager that her daughter was only 16. H.W. later removed the card from her mother’s purse and called him. Mr. Kelly told the girl that she should take a cab to his studio after her father dropped her off at school. There, at his studio on North Larrabee Street, they had intercourse and she performed oral sex on him, according to the documents. They had sex about once a month for a year. The fourth woman in the new cases, identified as L.C., was the only one who was an adult at the time of the alleged crime. She was Mr. Kelly’s 24-year-old hairdresser in 2003 when he entered the room with his pants down, according to the documents. He grabbed her head and tried to force her to perform oral sex. She resisted, prosecutors said, but he masturbated, and then ejaculated on her and repeatedly spit in her face. L.C. reported the event to law enforcement officials and gave them the shirt she had been wearing that day; DNA testing found Mr. Kelly’s semen on the shirt. It was not immediately clear on Saturday why that case was not prosecuted when it was first reported. Mr. Greenberg, the singer’s lawyer, said that may have been a consensual encounter. The DNA will be a new piece of evidence that prosecutors did not have in Mr. Kelly’s first trial. The culture around sexual misconduct is new, too, in the wake of the #MeToo movement and the continued fallout from abuse by Catholic priests. Amid a ferocious outcry, Mr. Kelly’s record label, RCA, a division of Sony Music Entertainment, dropped him two weeks after the documentary aired. Along with the Chicago prosecutors, their counterparts in Atlanta, where Mr. Kelly also has lived, began looking into his conduct; federal investigators in New York are also gathering evidence, though the scope of their inquiry is not clear and Mr. Kelly has not been charged outside Illinois. “I am cautiously optimistic,” said Kenyette Tisha Barnes, co-founder of the #MuteRKelly social media campaign. “The difference between this indictment and the last indictment is that you didn’t have the degree of public pressure to get him convicted in 2008. It was actually the opposite — more people wanted him acquitted.” "
5c9c007549f0eacbf105f6b2,https://www.nytimes.com/2019/03/27/obituaries/ranking-roger-dead.html,"Ranking Roger, a vocalist for the popular British ska band the Beat in the late 1970s and early ’80s who carried on that group’s infectious sound in subsequent bands and solo projects, died on Tuesday in Birmingham, England. He was 56. An announcement on his current group’s website said he had received a cancer diagnosis last year. Ranking Roger, whose real name was Roger Charlery, was one of two frontmen for the Beat, along with Dave Wakeling. The group, which was known as the English Beat in the United States to avoid confusion with a California power-pop band of the same name, had a brief but influential run after its founding in 1978, expanding on the ska sound, a lively precursor to reggae that had first migrated to England from Jamaica in the 1960s. “Ska is their base,” The Boston Globe wrote of the Beat in 1981, “but it’s infused with satisfying pressure-cooker-like tension and cut with reggae, pop and soul elements.” Neil Strauss, looking back on the group’s heyday in a 1995 article in The New York Times, described the Beat’s sound as “Jamaican ska informed by punk rock.” Mr. Charlery, who was black, and Mr. Wakeling, who is white, complemented each other: Mr. Wakeling was a more traditional vocalist, while Mr. Charlery “toasted,” the Jamaican version of rapping. The Beat’s best-known songs include a jaunty 1979 cover of “The Tears of a Clown,” which had been a hit for Smokey Robinson and the Miracles, and “Mirror in the Bathroom,” their biggest hit, which reached No. 4 in Britain in 1980. Some of the Beat’s songs had a political edge, notably “Stand Down Margaret,” a critique of Prime Minister Margaret Thatcher and her Conservative Party policies. “I said I see no joy, I see only sorrow,” the two vocalists sang. “I see no chance of your bright new tomorrow. So stand down Margaret.” But in a 1988 interview with The Globe (Mrs. Thatcher was still prime minister, and would remain in office until 1990), Mr. Charlery expressed some disillusionment about the power of music. “I sang ‘Stand Down Margaret’ for five years and no one listened,” he said. “She got in, and she got in again, and she’ll probably get in again. It goes to show how blind people are. Basically, I don’t think people ever listen.” After the Beat broke up in 1983, Mr. Charlery and Mr. Wakeling formed a new group, General Public. It broke up three years later, but the two men got back together for some shows in 1995. “Goodbye, Rog,” Mr. Wakeling posted on Facebook. “Thanks for all the fabulous years and wonderful memories.” Mr. Charlery was born on Feb. 21, 1963, in Birmingham to Jean Baptiste and Anne Marie Charlery, who were from St. Lucia in the Caribbean. He grew up in Birmingham and nearby Stechford and attended Tile Cross Academy. “My parents expected me to go into a factory,” he told The Birmingham Mail in 2016, when he released a new album, “Bounce,” as the Beat Featuring Ranking Roger. “I didn’t see that. I wanted to be a mechanic or a carpenter if anything.” His parents were destined to be disappointed. “Mum, Anne Marie, cried when I was on ‘Top of the Pops,’ ” he said, referring to the British television show, “and I knew I had done something right.” The Beat was born in part out of frustration with the conservative turn in England’s politics. “To the English Beat,” Robert Palmer wrote in reviewing the group’s second album, “Wha’ppen?,” in The Times, “unemployment, ecology and the antinuclear movement are not separate issues; they are interrelated.” “Anyone who would like to understand more about the attitudes underlying Britain’s inner-city rioting,” he added, “would do well to start here.” Mr. Charlery’s survivors include his partner, Pauline; five children, Matthew, Leon, Reuben, Luci and Saffren; and four sisters. In later years Mr. Charlery recorded and performed on his own and with variously named groups, among them Special Beat. (Mr. Wakeling had his own Beat-related group.) His most recent album, “Public Confidential,” again as the Beat Featuring Ranking Roger, was released this year. Another incarnation, in 2007, was the New English Beat, which included Ranking Junior, his son. In an interview with The Bristol Post of England that year, Mr. Charlery spoke of why he thought his music seemed to have a cross-generational, cross-racial appeal. “When the Beat were originally going ’round,” he said, “our audiences were so mixed — black, white and Indian, young people and older heads. It was brilliant, and I think we have kind of achieved that today. It is a bit different, obviously, but it is a very friendly crowd and everyone walks out sweating and happy, and I tell myself that’s the most I could ask for.” "
