,0,1
5c5b048c3a125f5075c08503,https://www.nytimes.com/2019/02/06/arts/music/lincoln-center-92nd-street-y.html,"Lincoln Center, which has been buffeted by leadership churn in recent years, has looked to Broadway and academia for its last two presidents. They didn’t take. Now it is looking to the East Side of Manhattan, and to someone with a background running a large nonprofit cultural and community center. Lincoln Center announced Wednesday that its next president and chief executive would be Henry Timms, who leads the 92nd Street Y. The difficulties Mr. Timms, 42, will face at the center, the nation’s largest performing arts complex, are substantial. He must help get the long-delayed renovation of the New York Philharmonic’s home, David Geffen Hall, back on track after a series of false starts. He will need to keep the complex’s finances stable at a tough time for arts organizations. And he will have to work to improve Lincoln Center’s sometimes fraught relationships with the powerful independent organizations that make it their home, but do not answer to it — including the Metropolitan Opera, the Philharmonic and New York City Ballet. “I don’t think you should ever pretend that there aren’t some real, and interesting, management challenges here,” Mr. Timms said in an interview. “But I think it’s the case that every constituent’s best interest is served in a collaborative culture.” The 92nd Street Y has a $69 million annual budget, just over half of Lincoln Center’s; a powerful and wealthy board; and a wide variety of offerings that include a distinguished concert program and lecture series. While leading it, Mr. Timms helped create #GivingTuesday, which urges people to donate to charities on the Tuesday after Thanksgiving and has grown into a national movement. He raised $160 million toward a $180 million capital campaign for the Y, and used virtual reality to help people think about how to remake its buildings. And he helped the Y recover from one of its most difficult periods. His predecessor there, Sol Adler, was fired amid accusations that he had an affair with an employee, and there was an investigation into whether another manager there had been demanding kickback payments from vendors. Mr. Adler committed suicide in 2014, and his widow sued the Y. Mr. Timms’s ability to steer the Y through that trying time was one of the things that impressed Katherine Farley, the chairwoman of Lincoln Center’s board. “He inherited a very tough, tragic, complicated situation, any way you look at it,” Ms. Farley said in an interview. “His temperament is one of collaboration; he seems to have a low ego need.” That collaborative approach could help ease tensions at the complex. Although Lincoln Center was founded to serve essentially as the landlord to constituent organizations, over time it began offering its own performances and series, including Mostly Mozart and Great Performers — leading to competition for resources, ticket sales and contributions. Running the center has never been easy. Reynold Levy, who led it for a dozen years and left in 2014, called his memoir “They Told Me Not to Take That Job.” Things have been rocky since. Mr. Levy’s successor, Jed Bernstein, a producer who had led the Broadway League, was removed after only 27 months. An interim team took over until the center found its next president: Debora L. Spar, who had been the president of Barnard College. She was pushed out after a year, after clashing with the center’s senior staff, who were backed by the board. Then Lincoln Center named Russell Granet, who had run its education division, acting president — spurring speculation that he was next in line. Some of the leaders of the complex’s resident arts organizations expressed concerns that Mr. Granet did not have enough prior experience for a job of the scale and stature of running Lincoln Center, according to an arts executive who requested anonymity to discuss sensitive conversations. The leaders wrote Ms. Farley, asking for a meeting. When they met, they discussed the kind of leader they believed the center should seek. “They mentioned some qualities that really describe Henry to a T,” Ms. Farley said, adding that several constituents, including Deborah Borda, the president and chief executive of the Philharmonic, had mentioned Mr. Timms as someone to consider. “They said things like: someone who had an entrepreneurial instinct; someone who had a strong connection to the arts and who had real appreciation for excellence, and what was finest about Lincoln Center; someone who could create synergies across the campus to take all of what we do at Lincoln Center to a new level.” Ms. Borda said that she was pleased with the selection, and believed they would be ready to proceed with the next steps of the Geffen Hall project soon. “I think it is an exceptional appointment, and I really felt an immediate click of a true partnership with him,” she said in an interview. And Peter Gelb, the general manager of the Met, said that Mr. Timms’s experience made him a “great choice.” Mr. Gelb added that he was heartened that Lincoln Center had paid serious attention to its constituents during the search process. Asked if the Met had a wish list from the incoming administration, he said, “The Met’s wish list is the same as the other constituents: that Lincoln Center regard them with the importance they deserve, since they are the fundamental elements of what makes Lincoln Center Lincoln Center.” Mr. Timms — who grew up in Exeter, England, and is the author, with Jeremy Heimans, of “New Power,” a book about leadership in an increasingly interconnected world — will need to hit the ground running. The center’s leadership struggles have slowed big projects, including the renovation of Geffen Hall, which has been on and off for 20 years. Ms. Farley landed a $100 million gift from the entertainment mogul David Geffen in 2015, and renamed the building for him. But there were concerns that the early plans for a revamp would cost considerably more than the initial $500 million price tag people spoke of. And the proposal threatened to keep the Philharmonic out of the hall for several seasons of construction. In 2017, Ms. Spar and Ms. Borda, who was just starting at the Philharmonic, scrapped the plans and went back to the drawing board. Mr. Timms said it was too soon to say what his vision for Geffen Hall was. Ms. Farley promised that more plans for the hall would be shared in the near future, and said that they would still be transformative. “It’s going to be really exciting,” she said. "
5c6d3a283a125f5075c0a924,https://www.nytimes.com/2019/02/20/world/asia/k-pop-identical-korea.html,"HONG KONG — Doe-eyed with delicate features. A sharp jawline and willowy figure. Fair skin so clear it almost glows. With many South Korean pop idols fitting that description in their sleekly produced music videos, their mass appeal has many of the country’s young people wanting to look just like them. But in an effort to tone down their influence in a beauty-obsessed country where plastic surgery is rampant, South Korea’s government is trying to limit the stars’ presence on television, saying they look too much alike. “Are all the singers on television music programs twins?” the Ministry of Gender Equality and Family wrote about the stars of K-pop, as their music is known, in broadcast guidelines released this month, according to The Korea Times. “They seriously look identical,” it said, adding that many pop idol groups’ musical styles were “just as limited as their appearances.” The guidelines drew such criticism from fans that on Tuesday the ministry apologized for “causing unnecessary confusion,” and said that some of the recommendations would be removed or reviewed, the news agency Agence France-Presse reported. Some compared the guidelines to the censorship imposed during the country’s military dictatorship during the latter half of the 20th century. An online petition, calling for the ministry to be dissolved, read, “The ministry has dared to point out female idols for being too pretty, wearing the same clothes and being skinny,” according to the newspaper Korea Joongang Daily. Ha Tae-kyung, a politician from an opposition party, compared the guidelines — which the gender ministry said applied to both female and male performers — to restrictions on hair and skirt lengths during the dictatorship. “There are no objective standards to people’s looks,” he wrote in a Facebook post on Saturday. It wasn’t the first time Mr. Ha had defended influential K-pop band members. Last year, he called for them to be exempt from the county’s military draft, since top classical musicians are given exemptions. The guidelines were intended to make television a more benevolent experience. Ministry officials said on Monday that viewers worried that television shows “exacerbate inequalities and gender stereotypes, rather than fixing it,” the Korea Joongang Daily reported. In the guidelines, officials suggested that shows avoid featuring performers “whose appearances are exceedingly similar” in the same program. One in three South Korean women have undergone cosmetic surgery between the ages of 19 and 29, a  Gallup Korea poll has found — a trend that mirrors the narrow beauty standards epitomized by K-pop stars. Some South Koreans have openly celebrated having cosmetic surgery, documenting their physical transformations as a rite of passage. In a pair of videos called “Getting Pretty Before” and “Getting Pretty After,” members of the K-pop group SixBomb giddily went for manicures between appointments at a plastic surgeon, where their faces were prodded and poked. “Getting Pretty After” showed them wearing pink bodysuits in an operating room, prancing out afterward with altered faces. "
5c3667e23a125f5075c039ad,https://www.nytimes.com/2019/01/09/obituaries/dennis-johnson-dead.html,"Dennis Johnson, a composer who in 1959 wrote a trailblazing Minimalist work, a six-hour piano meditation of repeated notes and long pauses that went unheard for 50 years before being rediscovered, died on Dec. 20 in Morgan Hill, Calif. He was 80. His half brother, Don Wilson, said the cause was complications of dementia. Until 10 years ago, long after Mr. Johnson had dropped composing for a career as a mathematician, his music was known only by reputation. References to it were found in the writings of the composer La Monte Young, who described Mr. Johnson as one of his closest musical allies when they were students at the University of California, Los Angeles. Mr. Young is a founder of Minimalism, a genre of composition marked by repetition, gradual development and sometimes spare harmonies. Some of the most important contemporary composers, including John Adams, Steve Reich and Philip Glass, are at times associated with the movement or at least have incorporated such elements in their work. Mr. Young is credited with composing the first Minimalist work, his String Trio of 1958, which unfolded so slowly that listeners focused less on its sequence of notes than on its long, sustained tones and glacial pace. A year later, Mr. Johnson produced “November,” his piano work, which also moves glacially, starting with just two notes — a rising minor third — repeated several times before new material is added, in a process that yielded a flow of individual tones, sustained chords and silences. Mr. Johnson described his compositional method in a 2013 interview with the music magazine The Wire: “I would just sit down at the piano and diddle, and listen, and it would slowly grow, like out of a seed,” he said. “Even now, when I do mathematics, it seems to be that way.” Mr. Johnson’s innovations were repetition and generally consonant harmonies. Mr. Young has said that “November” influenced his own six-hour magnum opus, “The Well-Tuned Piano” (1964), considered an early landmark of the genre. But for the next 50 years “November” was virtually unknown. The path to its revival began in 1992, when Mr. Young gave the critic and composer Kyle Gann a cassette tape with a partial performance, by Mr. Johnson, running 112 minutes. Mr. Gann decided to reconstruct the score, using the tape and a handful of pages that Mr. Johnson had sent him detailing many of the work’s motifs as well as performance instructions. Mr. Gann performed a tag-team version of the piece with the pianist Sarah Cahill at the Second International Conference on Minimalist Music, at the University of Missouri, Kansas City, in 2009. That performance led to a 2013 recording by R. Andrew Lee for Irritable Hedgehog, a new-music label. Mr. Gann’s reconstruction has also been recorded by the Dutch pianist Jeroen van Veen. Though the score was unknown to most musicians until the release of Mr. Lee’s recording, its Minimalist qualities — and its influence on Mr. Young — have led to a reconsideration of Minimalism’s early history. Dennis Lee Johnson was born in Los Angeles on Nov. 19, 1938, to Leroy Johnson, a building contractor, and Eloise (Jeffcoat) Johnson, a seamstress. His parents divorced before he was 8, and when his mother remarried, the family moved to Canoga Park, Calif. In addition to Mr. Wilson, his half brother, Mr. Johnson is survived by a half sister, Judy Wilson Plouff. Mr. Johnson’s early talent for mathematics earned him a full scholarship to Phillips Exeter Academy in New Hampshire, where he completed high school. He enrolled as a math student at the California Institute of Technology in 1956. But after a year he became disillusioned, and although he had studied the piano only casually as a child, he decided to transfer to U.C.L.A. to study music. As part of Mr. Young’s iconoclastic circle, Mr. Johnson produced works that were often whimsical, like “Din,” in which 40 musicians screamed, clapped their hands and shuffled their feet in a darkened hall. They could also be conceptual, like a piece that consisted of a card containing only the word “Listen.” He continued performing for several years, both on the piano and on the hichiriki, a Japanese double reed instrument. When Mr. Young moved to New York, in 1960, Mr. Johnson remained at U.C.L.A., shifting his focus to ethnomusicology and, by 1962, to mathematical study. But he visited New York several times from 1960 to 1965, and played the hichiriki in early versions of Mr. Young’s performance group, Theater of Eternal Music. In 1966, Mr. Johnson gave up performing music publicly and began work on his doctorate in math, which he completed two years later. In 1969, he took a two-year position at the Institute of Advanced Study in Princeton, N.J. Beginning in the mid-1970s, he worked for a decade at NASA’s Jet Propulsion Laboratory, near Pasadena, first as a staff researcher and software developer and then as a consultant. Among his projects at the lab was the radio mapping of Venus — a mathematical reconstruction of the planet’s surface using radar data. He also taught mathematics at the University of California, Berkeley, and continued his own research in advanced algebra and geometry. His 1983 theorem, the Johnson homomorphism, is still studied in the field of geometric topology. After 1995, Mr. Johnson began working with Roger C. Alperin, a professor of mathematics at San Jose State University, on theoretical projects having to do with “understanding the symmetries of curves related to their geometry,” as Dr. Alperin explained it. Mr. Johnson’s final mathematical work, a collaboration with Dr. Alperin, was published in the German journal Beiträge zur Algebra und Geometrie (Contributions to Algebra and Geometry) in January 2016. "
5c69cf843a125f5075c0a2e8,https://www.nytimes.com/2019/02/17/obituaries/u-tin-dead.html,"U Tin, a slide guitarist who became a global ambassador for Burmese music while working as a plumber under a military dictatorship, died on Feb. 5 in Yangon, Myanmar. He was 87. His daughter Daw Win Win Toe said the cause was complications of diabetes. Mr. Tin was one of several prominent Myanmar musicians who incorporated Western instruments into a diverse canon that spanned folk tunes, classical Burmese music linked to ancient royal courts, and songs from the country’s 1950s-era cinematic golden age. In addition to guitar, he played banjo, mandolin and Burmese harp. Mr. Tin moved to Yangon in 1947, a year before the country, then known as Burma, gained independence from Britain. He found work as a plumber and began studying music. After a military coup in 1962 plunged Myanmar into decades of isolation and extreme poverty, Mr. Tin kept his day job and mostly steered clear of the regime’s state-sponsored traditional music and dance troupes. But he kept playing music, and his reputation as a brilliant slide guitarist grew, thanks partly to people outside Myanmar who invited him to perform around the globe. U Tin was born in the southwestern town of Kyaik Lat on July 8, 1931, to U Ba Aye and Daw Than Yi, both farmers. When World War II broke out, many residents of nearby Yangon, then known as Rangoon, fled to the surrounding countryside as the city came under attack by Japanese bombers. Some of them turned up in Mr. Tin’s town, and they happened to be musicians. “I got the chance to learn from them,” he said years later. Mr. Tin’s main instrument was a steel resonator guitar, similar to one played in American blues and country music by performers like Jerry Douglas and Son House. He played it sitting down, with the fretboard lying over his lap. It is unclear precisely how these guitars, which have roots in Hawaiian music, made it to Myanmar. One influence appears to have been Tau Moe, a Samoan guitarist who had been educated in Hawaii and performed in Yangon in the late 1920s, said Kit Young, a Washington-based scholar of Burmese music and a founder of Gitameit Music Institute, a nonprofit community center and music school in Yangon. But Mr. Tin was not much interested in the American style. Instead, he tuned his guitar to a Burmese scale and played within the rich musical terrain he already knew. Traditional Burmese music, from the country’s Bamar ethnic majority, features gongs, drums, harps, oboes and bamboo xylophones, among other instruments. It typically has syncopated, staggered phrasing and a tonal system unfamiliar to most Western listeners. Over the years, Mr. Tin studied with some of Myanmar’s finest musicians, including the guitarists Weiza Ba Saw Gyi and U Sein Maung and the singer and harpist Daw Saw Mya Aye Kyi, who had herself learned from court musicians for King Thibaw, the country’s last king. He also played with several musicians who had made their name in Yangon’s post-independence cultural heyday. A video from 1961 shows him playing with the Burmese singer U Aunt Gyi (and two Americans) on the lawn of the American ambassador’s residence. “We called him the living music dictionary,” said U Ne Myo Aung, the director of Gitameit Music Institute. In addition to his daughter Daw Win Win Toe, Mr. Tin is survived by his wife, Daw Cho Cho; two other daughters, Daw Win Win Nwe and Daw Myint Myint Nwe; and six grandchildren. His three sons died before him. Mr. Tin won a number of national prizes and played on the Burma Broadcasting Service. But there was never much money in that, and he kept working as a plumber at the Yangon City Development Committee until he was 60. Ms. Young said that Mr. Tin did not “kowtow” to the military junta that ruled the country for decades, and that the regime would not have wanted to send him abroad because the slide guitar was not a traditional Burmese instrument. But in the twilight of his career, Mr. Tin was often invited privately to perform abroad as an ambassador of that very tradition. He performed in Japan, Thailand, Germany, the Philippines and elsewhere. Ms. Young said his performances often received rapturous receptions, including a 2003 concert at the Asia Society in New York City. “Everybody went bananas,” she said. In his later years, Mr. Tin also worked at Gitameit Music Institute. He saw his mission as to somehow keep the old songs he knew alive. But the younger generation was not interested, he told a reporter in 2010, around the time that a half-century of repressive military rule was beginning to ease. “If the music is lost,” he said, “Myanmar will lose a piece of its soul.” "
