,0,1
5c3618343a125f5075c038d6,https://www.nytimes.com/2019/01/09/arts/music/philip-glass-john-adams-david-bowie-los-angeles-philharmonic.html,"Three years to the day after the death of David Bowie, two eminences of American music will come together in Los Angeles to pay tribute. John Adams is set to conduct the Los Angeles Philharmonic in the premiere of Philip Glass’s Symphony No. 12, “Lodger,” at Walt Disney Concert Hall on Thursday. The work is inspired by Bowie’s 1979 collaboration with Brian Eno and the producer Tony Visconti, the final album in what’s usually called their Berlin trilogy, which also includes “Low” and “Heroes,” both from 1977. Mr. Glass’s First Symphony, back in 1992, was based on “Low”; his Fourth (1996), on “Heroes.” “I put off the third for a long time — 20 years — before I realized that I owed them something,” Mr. Glass said in a recent telephone interview. Mr. Adams was also on the conference call — he in Berkeley, Calif., Mr. Glass in New York — to discuss the symphony, Bowie and whether Mr. Glass’s music is hard to conduct. Here are edited excerpts from the conversation. How did this symphony come about? PHILIP GLASS It’s part of a commitment I had made to David Bowie and Brian Eno to take three of their records and turn them into symphonies. In “Lodger,” to me the most interesting thing was the lyrics, the poems. In the earlier ones, the musical idea was quite challenging and worthwhile to work on, but when I got to “Lodger,” I didn’t find that interest in the musical part of it; the interest was in the text. After hedging a little bit, I thought I might as well make a song symphony. Mahler, of course, was the great one at that. I used seven of the texts; I didn’t use all 10. That would have pushed me over an hour, and I didn’t want to go there. I don’t know, John, if you’re aware of this, but this was written — the words were written — when David was living in Berlin. JOHN ADAMS Yeah, you mentioned that to me. GLASS And Brian was there, and Iggy Pop was there; those were his companions. They were there trying to make a movie out of “The Idiot” by Dostoyevsky. None of them spoke Russian, or German, even. But on the other hand, these were three really interesting people in our music world and music life, and made big statements — icons, all of them. ADAMS A really great text is just so generative; it produces the best music. If I have a concern about some operas these days, it’s that the texts are just not good enough. It doesn’t have to be someone with a deep literary background; it can be a David Bowie or Brian Eno. The great thing about American music is the total bleed-through of, if you want to call it that, high or low, popular versus art. I think both Philip and I share this. We have very loose filters in terms of classification. When did you first hear each other’s music? ADAMS The thing I remember most vividly is a tour of the ensemble doing excerpts from “Einstein on the Beach,” which I heard in San Francisco sometime in the 1970s. Then I actually conducted quite a bit of his music — a little piece, “Facades,” and then I think we did the very first performance of parts of “Akhnaten” in L.A. on a Phil program, 50 minutes’ worth. I did the Ninth Symphony, again with L.A., and then this. I came of age during what we now call the bad old days, when the world said you had a choice between European modernism and its American version, or Cagean aesthetics. Hearing Philip’s music and Steve [Reich’s] music was this wonderful, new possibility of a language that embraced both tonality and sort of living with a pulse, new, original and fresh. GLASS I was very much taken with hearing John’s work — of course, “Nixon in China,” we talked about a number of times. It’s not enough to create a style of music or identity of your own; what you really want to be is in the company of other people. It’s more meaningful to be part of a large group of people sharing ideas. He was the first time I met someone who wasn’t part of my immediate generation but had the interest and talent. How many operas do you have now? Five or six? ADAMS [Laughing] Not as many as you do! [Depending on how you count, Mr. Glass has composed nearly 30.] Is Philip’s music tough to conduct? ADAMS It continues to be a slow absorption of Philip’s orchestral music into the regular repertoire; I’m surprised that more conductors haven’t taken it on. He has a couple of symphonies, like the Eighth, where there are some real challenges rhythmically. But it’s not hard to conduct on a technical level. I think the challenge is creating a sound, and with some orchestras it’s simply getting them into the right frame of mind. Something like the Ninth Symphony, which is nearly an hour long, it demands a kind of Zen-like concentration by the players, the way some Bruckner symphonies do. It’s not like doing “The Rite of Spring,” where there’s a thrill every 10 seconds. You have a steady build and a long line. What does it pair best with? ADAMS I don’t think there’s a great challenge there. You could put anything with it. I see programs that have put a piece of Philip’s together with a Baroque piece; that makes sense in certain ways. I’ve put his smaller pieces on programs with my own music, but sometimes with Steve or Terry [Riley]: obvious harmonious conjunctions. This program we’re doing at the L.A. Phil, I’m doing with an old piece of mine, “Grand Pianola Music.” GLASS I’m delighted to be able to hear it again. I haven’t heard it in a long time. Philip, does it annoy you that these symphonies are still not done more widely? GLASS Quite the opposite: I’m astonished at the size of audiences I’m getting now. I never thought that this music would be accepted in the way it’s being accepted. I had my first performance with the New York Philharmonic when I was 80 years old. I mean, come on! I think it’s partly that I’ve been helped by a younger generation that has very broad ideas and taste, and I don’t seem nearly as strange as I used to be. I’ve become — not mainstream, that seems a little too far — but still I can tell from the Ascap [the music licensing agency] reports that the music is being used. ADAMS A central thing about Philip’s music is it is utterly original, it is immediately identifiable as his, and that is an extraordinary thing, and it’s actually a very rare thing. It’s such an astonishing thing that Philip did, which was to take very, very simple materials and a simple mode of expression, and create something that was original. And it just caught on in an immensely popular way. It’s an honor to be a part of it. GLASS I have to publicly apologize for getting you the score so late. ADAMS [Laughing] It’s O.K.; we all do it. "
5c40cbce3a125f5075c04f6a,https://www.nytimes.com/2019/01/17/arts/music/review-new-york-philharmonic-jaap-van-zweden.html,"The subscription-series format long commonplace at American orchestras, with a weekly offering of standard repertory, is looking a little, well, standard. Take the program Jaap van Zweden led with the New York Philharmonic at David Geffen Hall on Wednesday. There was no particular musical connection or thematic thread linking the two staples performed: Beethoven’s Second Piano Concerto and Rachmaninoff’s Second Symphony. Yet, on its own terms, this was an exceptional concert. The brilliant pianist Yefim Bronfman was the soloist in a pristine, elegant account of Beethoven’s youthful concerto. And for Philharmonic regulars trying to glean what special qualities Mr. van Zweden may be bringing to the orchestra in his inaugural season as its music director, the compelling performance he led of Rachmaninoff’s rhapsodic symphony revealed new dimensions of his artistry. I get impatient with the hourlong piece, which for all its lyrical richness can seem long-winded. During whole stretches, this plushly orchestrated symphony strikes me as a Rachmaninoff piano concerto that’s missing the solo part. When the orchestra goes through endless manipulations of some theme, I find myself wanting a pianist to break in and take charge with a cascade of steely chords. In trying to bring freshness to standard repertory works, Mr. van Zweden has a tendency to overdo things. With his insightful account of this symphony, though, he did almost the opposite. He brought out inner details, revealing the rhetoric of the piece — that is, the way phrases are written like sentences, grouped into paragraphs, even when the music seems on the surface to run on with overextended elaborations of themes. Rachmaninoff was in his mid-30s when he wrote the Second Symphony, first performed in 1908, and still felt bruised by the hostile reaction to his First a decade earlier. The slow Largo section that opens the piece unfolded like the introduction to an essay, with themes almost presented for consideration. The orchestral sound is rich and thick, with passages played over dark, sustained bass tones. Yet the performance had remarkable lucidity and breadth, which continued as the Largo segued into the restless, expansive Allegro main section of the first movement. Mr. van Zweden drew crisp, snappy playing from the orchestra in the exuberant, scherzo-like second movement. The intriguing way he began the slow movement made it seem like it starts in the middle of some long melodic line. His approach set up the Adagio’s true theme, a wistful, elegiac melody for solo clarinet, played gorgeously by Anthony McGill, the Philharmonic’s principal clarinet. The account of the finale captured all its headlong energy, music at once festive and frenzied. Mr. Bronfman has made news in recent years at the Philharmonic in the premieres of daunting concertos written for him by Esa-Pekka Salonen and Magnus Lindberg. There was plenty of sparkling passagework in his playing of Beethoven’s ebullient Second Concerto. But he seemed intent on highlighting the music’s reflective passages and poetic flights, especially in his dreamy account of the slow movement. It was a pleasure to hear such a lithe and refined account of Beethoven’s bracing concerto. Why it made sense to pair it with the Rachmaninoff symphony, though, I cannot say. "
5c44f58a3a125f5075c056a4,https://www.nytimes.com/2019/01/20/arts/music/review-cantata-profana.html,"Imagine a Renaissance-era nun, a mystic in the throes of dying, uttering her visions and predictions in sporadic, rapid-fire bursts while novices stand guard trying to understand and write down her words. This is believed to be what happened to Saint Maria Maddalena de’ Pazzi, who died in Florence in 1607. The Italian modernist composer Salvatore Sciarrino suggests what the extraordinary ritual must have been like in his hushed, twitchy and radically spare-textured “Infinito Nero: Estasi di un Atto” for soprano and eight instruments, composed in 1998. The excellent and adventurous young musicians of Cantata Profana gave a rare and quietly riveting performance of Mr. Sciarrino’s strange piece on Friday at St. Peter’s Church in Chelsea. Since 2013, Cantata Profana has been presenting shows, as they call them, which are often semi-staged and typically juxtapose very old and very new music. The players placed Mr. Sciarrino’s piece at the end of an 80-minute meditative show they titled “Visions of Silence.” To set the mood, the pianist Daniel Schlosberg played Alvin Lucier’s Music for Piano and Amplified Sonorous Vessels (1990), a piece in which intermittent, mostly soft, minimal piano sounds (single struck tones or intervals, wandering chords, fleeting squiggles of notes) are electronically refracted, prolonged or processed. This led to a Tarquinio Merula canzonetta for soprano and lute. In this short 1636 duo, the Virgin Mary (soprano Alice Teyssier) holds the baby Jesus in her arms, trying to get the restless infant to sleep, though she is overcome with premonitions of the suffering that awaits him. The lute (played by the fine Arash Noori) is curiously fixated on two notes, though these recurring pitches are often decorated with filigree. Next came the Russian composer Galina Ustvolskaya’s radically unconventional Symphony No. 5, “Amen” (1989), lasting just 15 minutes and scored for a curious ensemble: violin, oboe, trumpet, tuba, big wooden box and a speaker (Gleb Kanasevich), who says the Lord’s Prayer in Russian. The music is at once grave and grumpy, utterly serious and almost comic, swinging along in a foursquare meter like some slow march with a steady tread, each thematic note encrusted in a dour harmonic block. Then Mr. Noori returned to play Alessandro Piccinini’s “Toccata Cromatica” for solo lute (1623), a work in which lyrical strands spin out into soft-spoken swirling passagework. Ms. Teyssier was the compelling soloist, singing Maria Maddalena, in the Sciarrino piece, which over 30 taut minutes tries to evoke the scene of the mystic nun issuing her clipped bursts of words. The instrumentalists become her eight attentive novices, sitting for long stretches doing nothing, or just breathing in anticipation (the sounds of, say, a flutist playing a short tone then audibly inhaling), or sometimes muttering some jittery, quiet mini-phrase. Then Ms. Teyssier’s Maria would sing a frenzied burst of pent-up notes, and the instruments would scurry, trying to scribble down her words. Jacob Ashworth, Cantata Profana’s artistic director, conducted a suspenseful account of this radically episodic and spacey score. The audience in pews sat in almost complete darkness; the players were illuminated by theatrical lighting, so you had to give yourself over to this contemplative program, even when you could not read the translations of texts, even if you lost track of what piece was being played. A large and appreciative audience seemed ready to do so on a chilly Friday in a Chelsea sanctuary. "
5c93fbb049f0eacbf105e5a9,https://www.nytimes.com/2019/03/21/arts/music/nyc-this-weekend-pop-rock-jazz.html,"Our guide to pop and rock shows and the best of live jazz happening this weekend and in the week ahead. A-TRAK at Marquee (March 22, 11 p.m.). A touring D.J. for Kanye West in the early 2000s, this Canadian turntablist quickly graduated from trusted collaborator to label boss: In 2007, he co-founded Fool’s Gold, a Brooklyn-based record company that has championed artists like Danny Brown and Kid Cudi. He has also released his own work through the label, including 2016’s “In the Loop: A Decade of Remixes,” a box set compiling a selection of his 200-plus credited remixes (most notably, his version of “Heads Will Roll” by the Yeah Yeah Yeahs). A-Trak celebrates his birthday with a guest set at this trendy West Chelsea nightclub. 646-473-0202, marqueeny.com MARIAH CAREY at Radio City Music Hall (March 25, 8 p.m.). Since the early 1990s, this powerhouse has put the full might of her five-octave voice behind radio hits that straddle genres, from the honeyed daze of “Always Be My Baby” to the hip-hop flair of her “Fantasy” remix featuring Ol’ Dirty Bastard. Currently, Carey is on the road touring her 15th studio album, “Caution” — a record graced by collaborators like Ty Dolla Sign and Dev Hynes. It prioritizes a more subdued, of-the-moment R&B sound over the vocal theatrics for which Carey is known. Still, expect the singer to dust off the showstoppers for her hometown crowd.  212-465-6000, radiocity.com FLOHIO at Baby’s All Right (March 22, 8 p.m.). This Nigeria-born, British-bred rapper makes her way to Brooklyn this weekend to perform hard-charging songs that draw together elements of grime, trap and techno. An energetic M.C., Flohio — whose given name is Funmi Ohiosuma — floods her music with a brashness that she attributes to her South London upbringing. Ohiosuma recently told The Guardian, “Rap isn’t meant to be too happy; there’s meant to be grit in there.” That attitude guides her recent EP, “Wild Yout,” on which she touts her authenticity and taunts her detractors. Released in November, it was the culminating effort of her breakout year. 718-599-5800, babysallright.com JOSÉ GONZÁLEZ at the Apollo Theater (March 21-22, 8 p.m.). In his solo work, this Swedish-Argentinian songwriter is a practiced minimalist, painting pictures with just his fingerpicked guitar and soft vocals. But González transforms in the company of collaborators. His sound expands whether he’s recording with the folk-rock group Junip or touring with the String Theory, an experimental orchestra from Berlin and Gothenburg with whom he released a live album last month. The String Theory will join him for his two-night run at the Apollo, performing new arrangements of songs from González’s three solo albums. 212-531-5305, apollotheater.org [Read about the events that our other critics have chosen for the week ahead.] KAIA KATER AND KARINE POLWART at Carnegie Hall (March 23, 9 p.m.). This double bill showcases a range of folk traditions, embraced by two distinctly contemporary artists. For Quebec-born Kater, the Canadian folk songs of her childhood and the Appalachian music she studied while attending college in West Virginia serve as touchstones; Polwart, meanwhile, draws from the musical heritage of her native Scotland. The noted political dimension in the songwriting of both women makes this a natural pairing: Kater has sung about the Black Lives Matter movement and political strife in her father’s home country of Grenada, and Polwart’s 2018 album, “Laws of Motion,” addresses Trumpism and the experiences of migrants. 212-247-7800, carnegiehall.org TORRES at Le Poisson Rouge (March 22, 8 p.m.). In the six years since she released her debut album, the Brooklyn-based singer Mackenzie Scott (a.k.a. Torres) has made the journey from quiet, confessional songwriter to adventurous, often boisterous rocker. On her most recent album, 2017’s “Three Futures,” Scott textured her guitar work with industrial and electronic sounds, aiming to create something that engaged all five senses. For her show at this Manhattan multimedia club, expect sensory engagement, beginning with her ritual preshow burning of palo santo sticks. Annie Hart, of the trio Au Revoir Simone, will open, setting the stage with lush, synth-driven pop songs. lpr.comOLIVIA HORN ALTERNATIVE GUITAR SUMMIT at various locations (March 21, 25 and 27-28, 7:30 p.m.). Organized by the guitarist Joel Harrison, the annual Alternative Guitar Summit gathers some of the most talented six-string improvisers in jazz, post-rock and world music. This year’s festival begins on Thursday with a 50th-anniversary celebration of the music of Woodstock, at Le Poisson Rouge in Greenwich Village. Harrison will play music from the Richie Havens and the Grateful Dead songbooks alongside the Everett Bradley Choir. The guitarist Ben Monder and the vocalist Jo Lawry will collaborate on music by John Sebastian and the Band. And the guitarist Nels Cline, who’s best known for his work in Wilco, will revisit Santana’s iconic Woodstock performance. The summit’s second concert takes place on Monday, when Cline, Leni Stern and others will pay tribute to the esteemed guitarist (and multi-instrumentalist) Ralph Towner at Drom, in the East Village. It concludes on Wednesday and Thursday at Jazz Standard with solo shows from Towner himself. (On the last two nights, there will be second sets at 9:30 p.m.) alternativeguitarsummit.com AARON DIEHL TRIO at the Baruch Performing Arts Center (March 28, 8 p.m.). Diehl’s piano playing has the same courtly, dapper flare as his wardrobe (he’s usually attired in a crisp, dark suit, sometimes topped off with a pair of thick-framed glasses). Picking up the mantle of midcentury greats like Bud Powell, Barry Harris and Cedar Walton, he espouses the ideal of jazz as America’s classical music, whether he’s performing standards or his own neo-traditionalist compositions. He may be best known for his work alongside Cécile McLorin Salvant, an eminent young vocalist, but at Baruch the spotlight will fall squarely on Diehl and his trio, which features the bassist David Wong and the drummer Aaron Kimmel. They will be playing music from his most recent album, “Space, Time, Continuum,” as well as some new pieces.212-352-3101, baruch.cuny.edu/bpac FIRE! AND MADALYN MERKEY at the Clemente Soto Vélez Cultural Center (March 28, 8 p.m.). The tenor saxophonist Mats Gustafsson, one of Europe’s most uncompromising free improvisers, angles toward the void in Fire!, a trio that includes the bassist Johan Berthling and the drummer Andreas Werliin. Whether scrawling an illegible smear of notes across the top of a pounding beat or erupting in fury as the rhythm dissolves beneath him, Gustafsson keeps the intensity high and your ears alight — even when his tone skews murky and dark. Fire! shares the bill here with Merkey, whose semi-ambient electronic music guides listeners into a kind of dreamlike state. This concert — Fire!’s first ever in New York — is presented by the nonprofit organization Blank Forms.blankforms.org DEREK GRIPPER at Roulette (March 23, 8 p.m.). Gripper, a South African guitarist, has developed a virtuoso approach to playing Malian music that was originally composed for instruments such as the kora (a 21-string instrument, somewhere between a harp and a guitar) and the ngoni (a possible progenitor of the banjo). He fingerpicks his classical guitar in percussive swirls, producing a sound that’s as enlivening as it is hypnotic. His repertoire includes music by the kora master Toumani Diabaté and the guitarist Ali Farka Touré, as well as folk songs from South Africa’s Western Cape. This concert kicks off the fifth annual A World in Trance festival, which spotlights music from around the world with explicitly spiritual overtones.917-267-0368, roulette.org MANUEL VALERA AND THE NEW CUBAN EXPRESS BIG BAND at Terraza 7 (March 28, 9 p.m.). Valera, a Cuban-born pianist with a blazingly fluent right hand and a mellifluous compositional style, has long led the New Cuban Express, a midsize band that integrates elements of contemporary New York jazz with Afro-Cuban forms. On Thursday he will premiere a big-band iteration of the ensemble, featuring the vocalist Sofía Rei and the alto saxophonist Román Filiú, plus 16 other instrumentalists.347-808-0518, terraza7.com WEBBER/MORRIS BIG BAND at the Jazz Gallery (March 22, 7:30 and 9:30 p.m.). The tenor saxophonist and flutist Anna Webber recently put out “Clockwise,” an album full of atonality and friction and discomfited momentum — not to mention, some of New York’s premier improvising musicians. Angela Morris, a fellow saxophonist, shares some of Webber’s style, while also drawing more heavily on the influence of Impressionist composers and jazz’s most ancient styles. They have been playing their ambitious original compositions in this big band for a few years, and supposedly there’s an album on the way — but so far all we have to show for it are a few YouTube clips and a bit of buzz on the scene. To really hear the Webber/Morris Big Band, you’ve got to go in person.646-494-3625, jazzgallery.nyc GIOVANNI RUSSONELLO "
