,0,1
5c668e133a125f5075c09e0e,https://www.nytimes.com/2019/02/15/nyregion/saturdays-in-the-bronx-with-bach.html,"Sean Arias, 7, casually dressed in sweats and sneakers, climbed atop the piano bench, sat down on an aging textbook — a makeshift booster seat — and rested his feet on a copy of The New Grove Dictionary of Jazz. His instructor, Santiago Lomelin, a doctoral student at Rutgers University, led him through a series of warm-ups before flipping open a book to a short Bach piece. “Let’s learn a new song,” Mr. Lomelin said. Sean edged forward with finicky excitement, peering at the notes. He paused for a moment, processing — then leaned back in his seat and began to play, exploring the music with an impressive dexterity. “This program — thank God,” whispered Sean’s mother, Vanessa Peña, who was seated behind him in the practice room. “It’s been a true blessing. I’ve seen my son blossom.” Step into the Bronx Community College’s Guggenheim Hall at 8:45 on Saturday morning and you’ll find the sleepy weekend routine of the average American university: empty hallways, unlit classrooms, the hiss of a radiator. Fifteen minutes later, though, the place transforms — brimming with children (some as young as 4) and a handful of adults, each of them here for one-on-one classical instruction with some of New York’s most promising musicians. It’s a recurring scramble for classical music in a city perpetually starved for space. Since 1991, the Bronx Conservatory of Music, a nonprofit arts organization, has provided low-cost education in classical music to a constituency that has been historically underexposed to the tradition. And at a time when music classes are being cut from public schools everywhere, it has become an unlikely success story: a weekly pop-up school that trains students, more than 80 percent of whom are black or Hispanic, in a musical tradition long characterized by a lack of racial diversity. In the last four years, the school, led by a team of talented and ambitious young instructors, has seen its enrollment more than triple — there are around 170 students now, up from 50. But that success may ultimately jeopardize the school. The surge in students has led to increased anxiety about its relationship with Bronx Community College, which has allowed the school to operate out of its music department on Saturdays free of charge. “We’re really at capacity now in this location,” said Douglas W. Meyer, the conservatory’s music director and treasurer. He described the program’s arrangement with the college for the last three decades as an essential part of its operating model. “We’re able to provide competitive compensation to our teachers and the lowest possible tuition rates to our students because we are the recipient of the largess of the college, for which we are eternally grateful,” he said. “The good news is, we don’t have to maintain permanent facilities,” Mr. Meyer explained. “The flip side is that we’re here at the pleasure of the college.”  Changes to the arrangement, he said, could easily pose an existential threat; a rise in costs to offset rental payments, for example, could push the price of lessons beyond the reach of many students. A lack of permanent facilities also means that students must find a place to practice during the week. Students studying violin, cello and guitar can borrow an instrument from the school. (Many were donated to the school by WQXR, the city’s classical music radio station, following one of its instrument drives.)  But for students of piano, far and away the most popular instrument at the school, finding a piano to use can be a challenge.  “The dream,” said Philip Kwoka, the school’s executive director, “is to raise enough money for a permanent space where kids can come all throughout the week to practice.” Since space is already limited, the school has had to add dozens of families every year to its wait-list. “Our goal is eventually to be in a position where we can give everyone who’s interested an opportunity to study here.” It’s exactly the deal that draws in many of the families. The Bronx Conservatory charges $23 for a 30-minute lesson and $46 for an hour, and those prices include supplemental group-based instruction in rhythm, percussion and music theory. (Elsewhere in New York City, private music lessons can easily top $100 per hour.)  The teachers at the conservatory are mostly young graduates or postgraduates from schools in and around New York: Juilliard, Mannes, the Manhattan School of Music. Most balance teaching schedules with their own performance demands. “This school makes classical musical accessible to us,” said Frayma Rodriguez, who attended Bronx Community College and whose son, Jeremy, 11, studies guitar at the conservatory. “It’s here in the community, and it’s not too expensive.” Martha Forte, whose son, Antonio, 8, studies violin, travels from Yonkers each Saturday for his lessons. “The Yonkers public schools, they’ve slowly cut arts programs to bare bones,” she said. “It’s a 20-minute drive to get here, but it’s so much more affordable.” Ms. Forte is especially impressed with the commitment of the instructors, she said, adding that Antonio’s teacher, Katherine Dennis, will often FaceTime with the family during the week to help Antonio address various musical issues. Despite its relatively small size, the Bronx Conservatory has had ripple effects in the broader community. Janell Alvarez, 16, has attended the conservatory since she was 7, first as a student of piano and later of voice. When changes at her local church, St. Helena’s in Parkchester, left one of its Masses without an organist, Janell trained to fill in for the role. She now performs at the 5 p.m. service every Sunday. The school has been similarly transformative for Joaquin Estrella, a 10-year-old piano student. One of the school’s more advanced pianists, Joaquin won a full scholarship through the Bronx Conservatory last year to attend a summer camp at the Luzerne Music Center, an immersive musical program in New York’s Adirondack Mountains. “That was a very special experience for me,” said Joaquin, who wants to be a professional musician. “It gave me a chance to fit in.” His father, Jorge, stressed the importance of having found a suitable arts program that’s situated in the Bronx, where the family lives. “There’s a lot of cultural richness here, but the borough is really drained of resources,” Mr. Estrella said. “And if we want the Bronx to thrive, then we have to make a commitment to change, and to stay here, and to support programs like this.” That support is sometimes hard to come by. Fund-raising is now one of the organization’s biggest focuses, according to Mr. Kwoka, who is eager to find a way to welcome all the students currently on the wait-list and to provide more scholarships. But there are always smaller concerns, too: filing tax forms, registering students, rearranging teaching schedules to accommodate absences. And at the end of each Saturday, Mr. Kwoka has to pack away his computer, tidy the classrooms and box up the printer. By then, Guggenheim Hall has transformed back into a college campus. There is little to suggest that dozens of kids have spent their Saturday here playing classical music — aside, perhaps, from a set of music stands that might seem curiously low to the college students who use them during the week. "
5c78116e49f0eacbf105aae2,https://www.nytimes.com/2019/02/28/obituaries/andre-previn-dead.html,"André Previn, who blurred the boundaries between jazz, pop and classical music — and between composing, conducting and performing — in an extraordinarily eclectic, award-filled career, died on Thursday at his home in Manhattan. He was 89. His death was confirmed by his manager, Linda Petrikova. Mr. Previn wrote or arranged the music for dozens of movies and received four Academy Awards, and was nominated for three Oscars in one year alone — 1961, for the scores for “Elmer Gantry” and “Bells Are Ringing” and the song “Faraway Part of Town” from the comedy “Pepe.” Audiences knew him as well as a jazz pianist who appeared with Ella Fitzgerald, among others, and as a composer who turned out musicals, orchestral works, chamber music, operas and concertos, including several for his fifth wife, the violinist Anne-Sophie Mutter. He was also the music director or principal conductor of a half-dozen orchestras. [Listen to the full range of Mr. Previn’s multifaceted career.] Critics described Mr. Previn as a “wunderkind in a turtleneck” and the “Mickey Mouse maestro” when he was in his 20s and 30s. He was often compared to Leonard Bernstein, a similarly versatile conductor, composer and pianist. Time magazine’s headline when Mr. Previn became the principal conductor of the London Symphony in 1968 was “Almost Like Bernstein.” Newsweek summarized his appointment as music director of the Los Angeles Philharmonic in 1985 as “Bernstein West.” And like Bernstein, Mr. Previn was no stranger to a life of glamour and media attention, particularly when the actress Mia Farrow left Frank Sinatra, her husband, and married Mr. Previn after an affair that had become grist for the gossip columns. “See you in the Morning beloved Friend,” Ms. Farrow, who was divorced from Mr. Previn in 1979, tweeted on Thursday. “May you rest in glorious symphonies.” Mr. Previn himself considered Bernstein an idol. “Bernstein has made it possible not to specialize in one area of music,” he said. “You no longer have to do just Broadway shows, or movies, or conduct — you can do any or all of them.” And Mr. Previn did. In the 1960s, he appeared in sold-out classical and jazz concerts. Sometimes he combined genres, playing a concerto before intermission and jazz with a trio after. Dizzy Gillespie marveled at his performances. “He has the flow, you know, which a lot of guys don’t have and won’t ever get,” he said. Mr. Previn made recordings with Benny Carter and Mahalia Jackson and an album of jazz arrangements of songs from “My Fair Lady” with the drummer Shelly Manne and the bass player Leroy Vinnegar. (Mr. Previn was later the conductor and music supervisor for the film version of “My Fair Lady.”) He also made two albums with Dinah Shore and recorded a collection of Christmas carols with Julie Andrews and George Gershwin’s “Rhapsody in Blue” with Andre Kostelanetz. But the classical world was never comfortable with his work in jazz, and the jazz historian Ted Gioia said Mr. Previn had been “something of a popularizer of jazz rather than a serious practitioner.” Mr. Previn disdained all the labels. “I never considered myself a jazz musician,” he said in 1986, “but a musician who occasionally played jazz.” He was born Andreas Ludwig Priwin on April 6, 1929, in Berlin. After his parents realized he had perfect pitch — his father had been an amateur pianist in Berlin — André entered the Berlin Conservatory when he was 6. His father, Jacob, a Polish-born lawyer who was Jewish, moved the family to Paris in 1938 to escape the Nazis. While in Paris, Mr. Previn later recalled, he had some lessons with Marcel Dupré before the family left for Los Angeles about a year later. There, he studied with the composer and conductor Mario Castelnuovo-Tedesco, the violinist and composer Joseph Achron and the composer Ernst Toch. He soon recorded all the four-hand piano music of Mozart with the composer Lukas Foss, who was not quite seven years older than Mr. Previn. Mr. Previn became an American citizen in 1943, and in 1950 he was drafted into the Army and served with the Sixth Army Band. He also studied conducting in San Francisco with Pierre Monteux, whom he later followed at the London Symphony. A relative worked in the music department at Universal Studios, and Mr. Previn wrote music for movies even before he went into the Army. As a senior in high school, he was called in to help with “Holiday in Mexico,” a 1946 MGM musical starring Walter Pidgeon. (A young Fidel Castro was an extra.) The script called for the concert pianist Jose Iturbi to play some jazz, but he was uncomfortable improvising and wanted a score to read. Mr. Previn went to a jam session, listened and wrote out a piano part for Mr. Iturbi to play when the cameras rolled. MGM took notice and hired Mr. Previn to compose and conduct the music for “The Sun Comes Up,” starring Lassie and the once-illustrious actress Jeanette MacDonald, who was allergic to dogs. “Go figure that billing,” he once said. Years after its premiere in 1949, he gave the movie a thumbs-down. “Like all Lassie pictures,” he said, “there was hardly any dialogue, but a lot of barking. I thought it was easy, but I have since put myself through the wringer of watching it on a television rerun, and it’s the most inept score you ever heard.” But front-office executives realized that Mr. Previn could handle the deadlines that went with studio work, and they put him on what he called “an endless stream of cheap, fast movies.” Not all his assignments fit that description. He collected Oscars for scoring “Gigi” (1959), “Porgy and Bess” (1960), “Irma La Douce” (1964) and “My Fair Lady” (1965). He did not write classic songs like “Summertime” and “I Could Have Danced All Night”; rather, he arranged and orchestrated them, creating the soundtrack versions. Like Bernstein, Mr. Previn also tried Broadway. With Alan Jay Lerner, he wrote “Coco,” a musical about the designer Coco Chanel that starred Katharine Hepburn and ran for 329 performances in 1969 and 1970. He also wrote the music for “The Good Companions,” a musical with lyrics by Johnny Mercer that ran for 252 performances in London in 1974. Also like Bernstein, Mr. Previn was a crowd-pleaser as a conductor. Five years after his surprise appointment in London, the British magazine New Statesman complained that he had given the orchestra “a strong American accent: the big-screen sound, rich, loud and brilliant.” But it said his programs on the BBC — which prefigured by a few years the American public-television series “Previn and the Pittsburgh,” broadcast when he was the music director of the Pittsburgh Symphony — had “clearly widened his box-office appeal.” “Whereas Boulez looks boring and Boult looks bored,” the magazine said, referring to the prominent conductors Pierre Boulez and Adrian Boult, “Previn always seems to be enjoying himself.” He remained principal conductor of the London Symphony until 1979; he was also the principal conductor of the Royal Philharmonic Orchestra from 1985 to 1988. In the United States, he held the Pittsburgh job from 1976 to 1984 right before taking over in Los Angeles. Mr. Previn resigned the Los Angeles post in 1989, complaining that the orchestra’s managing director, Ernest Fleischmann, had maneuvered to bring in Esa-Pekka Salonen as his successor. “It has become obvious to me that there is no room for a music director,” Mr. Previn said when he quit. Mr. Salonen was named music director-designate a few months later. As he approached 70, Mr. Previn turned to opera, writing “A Streetcar Named Desire” to a libretto by Philip Littell based on the Tennessee Williams play. Renée Fleming sang the role of Blanche DuBois in the premiere with the San Francisco Opera in 1998, with Mr. Previn on the podium. Bernard Holland, reviewing the performance for The New York Times, wrote that “it sings very well.” “There are angry clashes of harmony and key,” he added, “many Straussian gestures, sweet-as-honey popular melody and the kinds of corporate noodling and mumbling among the strings native to a Ligeti or a Penderecki.” A recording with the San Francisco cast won the Grand Prix du Disque. Mr. Previn also won 10 competitive Grammys from 1958 to 2004, divided evenly between classical and nonclassical categories, and a lifetime achievement Grammy in 2010. The second of his two operas was “Brief Encounter” (2007), with a libretto by John Caird based on Noël Coward’s screenplay for the 1945 David Lean film by that name. Toward the end of his life, Mr. Previn seemed surprised at the interest in his compositions. ”I wrote a string quartet that I very diffidently mentioned to the Emerson Quartet,” he told the critic David Patrick Stearns in 2017. “And they said, ‘Where is it?’ I’m not used to that.” In 2017, Ms. Fleming gave several performances of a song cycle he wrote, “Lyrical Yeats.” “These brief songs display Mr. Previn’s keen ear for the telling detail, for musical gestures that set a mood or conjure an image,” Corinna da Fonseca-Wollheim wrote in The Times when Ms. Fleming sang them in a solo recital at Carnegie Hall. In 2018, Ms. Mutter played “The Fifth Season,” for violin and piano, which she and Carnegie Hall had commissioned. She described it as “rather lighthearted.” This year, Tanglewood had planned events to celebrate Mr. Previn’s 90th birthday, including a performance of the violin concerto “Anne-Sophie” with Ms. Mutter and, with Ms. Fleming and the Emerson quartet, the premiere of “Penelope,” by Mr. Previn and the playwright Tom Stoppard. Tanglewood said the events would now be framed as a celebration of his life and work, although it was not immediately clear if Mr. Previn had finished “Penelope.” Mr. Previn wrote several books, including “Orchestra” (1979), a depiction of the lives of orchestral musicians, and a memoir of his movie experiences, “No Minor Chords: My Days in Hollywood” (1991). Mr. Previn’s first wife, Betty Bennett, was a singer he had seen in San Francisco jazz clubs. They had two daughters, Claudia and Alicia, also known as Lovely (who became a violinist in the Irish band In Tua Nua), and divorced in 1958. His second marriage was to Dory Langan, an MGM lyricist, who, after they separated, recorded several albums as a singer-songwriter under the name Dory Previn, many of them reflections on their breakup and its aftermath. Dory Previn died in 2012. Their divorce in 1970 was prompted by the well-publicized affair between Mr. Previn and Ms. Farrow, who had been a friend of Ms. Previn’s. Ms. Farrow divorced Sinatra in 1968 and married Mr. Previn in 1970. They had three children, Matthew and Sascha, who were twins, and Fletcher. They also adopted three daughters: Summer Song, known as Daisy; Soon-Yi, who married Woody Allen in 1997; and Lark, who died in 2008. Mr. Previn’s fourth wife was Heather Hales Sneddon. They had a son, Lukas, and a daugher, Li-An, and divorced in 2002. He and Ms. Mutter married in 2002 and divorced in 2006 but continued to perform together. “You know how people say that their marriage didn’t work?” he said in 2017. “With us, the divorce didn’t work. We call each other every day regardless of where we are. Maybe she’s in China and I’m in Cincinnati, but we find each other. It’s like being very best friends who have a romantic history.” Complete information on his survivors was not immediately available. Mr. Previn seemed puzzled that critics continued to mention his Hollywood past long after he had been focusing on classical music. “I haven’t done anything else since the mid-’60s,” he told The Times in 1991. “I think there’s a statute of limitations here. “When I go to Tanglewood to teach, the kids don’t know I ever did anything else,” he continued. “Sometimes they see a movie on the late, late show, and they say, ‘Who is that?’ And then I have to confess that the man who manufactured harp glissandos for Esther Williams to dive to was actually me.” "
5c4e117b3a125f5075c0695b,https://www.nytimes.com/2019/01/27/arts/music/juilliard-focus-festival-review.html,"Think of the great patrons of music, and some resonant names come to mind: Nikolaus, Prince Esterhazy, for instance, who for three decades employed Joseph Haydn; or Cardinal Pietro Ottoboni, who funded Italian baroque luminaries. But cast around for their successors — the most important commissioners of living composers — and you encounter a string of initials: BBC, WDR, SWR. The fertile generosity of these public broadcasters (the latter two are Westdeutscher Rundfunk and Südwestrundfunk, regional radio entities with headquarters in Cologne and Stuttgart) is the subject of this year’s Focus Festival at the Juilliard School. It opened on Friday with a stimulating concert by the New Juilliard Ensemble in the Peter Jay Sharp Theater in Manhattan. Under the banner “On the Air! A Salute to 75 Years of International Radio Commissioning,” the festival presents five more programs, through Feb. 1, that reveal how much of a lifeline noncommercial radio has become to composers since the end of World War II. The conductor Joel Sachs, who designed the festival and led Friday’s concert, said in a phone interview that a British composer had told him bluntly: “We’d all starve without the BBC.” While the festival draws attention to the wealth of opportunities created by international broadcasters, it also points a finger at the glaring absence of similar initiatives in the United States. “The problem with commercial radio is that it doesn’t want to do anything as esoteric as classical music,” Mr. Sachs said, “let alone commission contemporary music.” Mr. Sachs said that in his research he had learned of a handful of new works commissioned by isolated American broadcasters, including stations in Minnesota and Cincinnati. But these numbers paled next to the statistics he gathered of radio commissions from Europe and Canada in the postwar era. The BBC supplied a list, possibly incomplete, of nearly 1,600 compositions. Radio France listed 2,300 titles. German regional broadcasters were each responsible for hundreds of works. Canadian composers have benefited from the robust support of the CBC, which commissioned some 1,200 pieces. These broadcasters are cultural powerhouses, and not just on the airwaves. Most have their own ensembles, including symphony orchestras and choirs, and run festivals like the Witten Days for New Chamber Music, organized by the WDR, or the Donaueschingen Festival, a storied engine of avant-garde music that is now under the auspices of the SWR. Each summer the BBC Proms whip up public enthusiasm and draw huge crowds with televised concerts that include new commissions. Some countries make a point of targeting their commissioning largess toward their own composers. One example is Finnish Radio, which sees fostering new Finnish music as part of its mission. That’s how a Modernist gem like Jouni Kaipainen’s “Trois Morceaux de l’Aube” came into being. It received a superb performance on Friday by the cellist Sasha Scolnik-Brower and the pianist Michalis Boliakis. A radio commission gave life to this darkly ruminative work, shot through with flashes of rhythmic exuberance, in 1981, when the composer was 25. In Germany, where the postwar occupying powers designed a decentralized broadcasting landscape free of government control, the mission is broader. In a phone interview, Harry Vogt, who has headed the new music program at the WDR for decades, said he sees it as his responsibility “to produce things, far from commercial considerations, that wouldn’t come into being on their own.” The balancing act there lies in staying accountable to the public through programs — “you don’t want to do things that interest nobody,” he said — while granting composers the creative freedom to develop their art away from the pressures of the market. Mr. Vogt said his commissions also extend beyond the concert hall to sound installations in public and industrial spaces in order to reach new listeners. “There is always an educational component, too,” he said, “though you try to avoid it reeking of pedagogy.” Friday’s concert proved that, in casting the net wide, the patronage of the broadcasters reels in works of varying quality. I was underwhelmed by Colin Matthews’s “A Voice to Wake,” with its vocal line that felt somehow both sibylline and mechanical. The Korean-German composer Younghi Pagh-Paan’s “U-MUL (The Well),” commissioned by WDR, relied a little too heavily on watery sound painting. On the other hand, listeners are indebted to Radio France for Akira Nishimura’s beguiling “Corps d’Arc-en-Ciel,” with its brilliant play on density and light. And, in this context, it was instructive to hear Salvatore Sciarrino’s “Archeologia del Telefono,” an instrumental work infused with his trademark fragility, in which brittle sounds hover on the edge of imperceptibility, carrying subtle charges of humor. In concert, Sciarrino’s music fascinates in part because of the odd techniques used to draw sounds from the instrument. I couldn’t help but wonder how a radio listener would interpret the dry flutter produced by a violinist bowing what looked like a Post-it note tacked to her instrument. The esoteric sound world of such works requires an even more intense concentration on the part of the radio listener who, unlike the audience in the room, is literally all ears. "
