,0,1
5cb1cf9e49f0eacbf1f83ba8,https://www.nytimes.com/2019/04/13/arts/music/classical-music-youtube.html,"[Read all of our classical music coverage here.] Readers! Here’s a lovely profile of the composer George Crumb, who is getting a little festival from the Chamber Music Society of Lincoln Center on Sunday and Tuesday as he approaches his 90th birthday this fall.  Corinna went out to his home studio in Pennsylvania, and we pulled together some highlights from a rich career of wondrous sounds: Here’s “Black Angels,” inspired by the Vietnam War and written for amplified string quartet, complete: And here’s the much-loved “Vox Balaenae”: In other news! A crazy story out of Hungary: When the Hungarian State Opera’s white cast of singers came together in Budapest earlier this month to revive a production of George Gershwin’s opera “Porgy and Bess,” they received letters carrying an unusual request: to declare themselves African-American.  Jaap van Zweden, the New York Philharmonic’s music director, burned himself while icing himself last week — I know, I know — so Simone Young jumped into this weekend’s performances of Mahler’s Sixth. Josh opines that her extensive work in opera may have informed her approach. With the Pulitzer Prizes set to be announced on Monday, Will Robin looked at the history of the music prize, its future in a bit of flux after last year’s surprise award to Kendrick Lamar’s hip-hop album “DAMN.” The Shed, the $500 million performance space at Hudson Yards, opened last weekend, and our critics devoured the first offerings. And finally, be dazzled by the winner of this year’s Richard Tucker Prize, the soprano Lisette Oropesa: Enjoy the weekend! ZACHARY WOOLFE As the Miller Theater at Columbia University begins to wrap up its 30th-anniversary season — a Composer Portrait concert featuring David T. Little’s music comes next, on Thursday — I’ve been thinking about some of the best concerts I’ve heard there in recent years.  One particularly fine show was in October 2007, when the composer David Sanford conducted his own big band ensemble, the Pittsburgh Collective. Both raucous and exquisitely poised, the music was decked out with some broadly perceptible reference points — including traces of classical modernism, jazz improvisation and the attack of punk. Yet it was the composer’s way of combining these surface-level traits that proved most memorable.  While Mr. Sanford’s music is not heard in New York nearly enough, a taste of his more recent work is available, thanks to a set on the Boston Modern Orchestra Project’s label. The 11-minute work that gives the album its title, “Black Noise,” is a 2017 piece commissioned by the orchestra, known as BMOP.  Less immediately boisterous than some of what Mr. Sanford has written for his own band, “Black Noise” lavishes time on an investigation of spectral trends in contemporary classical harmony. In his liner notes, Mr. Sanford cites composer Fausto Romitelli as an influence, as well as the “harmonic world” of Pierre Boulez. Boulez’s “Notations” for orchestra don’t feel all that far away at points. But other of Mr. Sanford’s stylistic predilections also push themselves to the fore, including a frenzied section in the middle, which is helped along at first by authoritative, pizzicato bass lines, suggestive of Mr. Sanford’s appreciation for Charles Mingus. SETH COLTER WALLS "
5ca7aeaf49f0eacbf1f813d8,https://www.nytimes.com/2019/04/05/arts/music/classical-music-youtube.html,"[Read all of our classical music coverage here.] Readers, welcome to the weekend! I wouldn’t recommend the trip to Brooklyn for Ivo van Hove’s sluggish, overstuffed staging of Janacek’s “Diary of One Who Disappeared” at BAM.  I would, though, recommend listening to the piece, which I offer below in two versions, the original (for voices and solo piano) and a later, lusher orchestral arrangement (played gorgeously by the Berlin Philharmonic under Claudio Abbadio). And read Thomas May’s moving story on the composer George Walker, whose Sinfonia No. 5, “Visions” — his response to the 2015 shooting at the Emanuel African Methodist Episcopal Church — has its first live performance in Seattle on April 11. (His hands on the piano are in the photo above.) I leave you with Anna Netrebko’s “Pace, pace” from the London “Forza del Destino” I was lucky enough to attend recently. Happy listening! ZACHARY WOOLFE The Criterion Collection recently released a new restoration of Ingmar Bergman’s 1975 screen adaptation of “The Magic Flute” — a stylized and slightly bonkers Swedish-language take on Mozart’s opera. It’s a film as much about Bergman’s love of the opera as it is a film of the piece itself. The director sets it in a theater, presenting both his vision for a staging and the experience of putting on a performance. During the overture, you never see the orchestra; instead, the camera settles on the face of a young girl experiencing Mozart’s magical score for the first time. Then you see other faces: young, old, male, female, white, brown. This is music for everyone. Throughout the show, Bergman moves fluidly between onstage action and backstage humor. Papageno nearly misses his entrance because he is napping. He rolls out of his dressing room and runs to the wings, where is outfitted with his birdcage backpack and pan flute just in time to play the flute’s famous upward scale. During intermission, the Queen of the Night is seen smoking under a sign that says “Smoking strictly forbidden,” while the dragon walks awkwardly down the corridor and Tamino and Pamina play chess to pass time. This is nothing like the opera films of Franco Zeffirelli, which are lavishly literal-minded. It’s much stranger and smaller, and endlessly endearing. JOSHUA BARONE The pianist Emanuel Ax played works by Brahms, Ravel and Chopin splendidly at his recent recital at Carnegie Hall. But I was especially stuck by his pairing of two seemingly disparate works, when he followed an alluring account of George Benjamin’s “Piano Figures” (2004) with Schumann’s “Fantasiestücke,” hardly taking a break between the two.  In juxtaposing old and new works, an artist can call attention to resonances that bridge centuries. That’s what happened here. Mr. Benjamin’s 14-minute “Piano Figures” is a set of 10 elusive miniatures, each exploring a different element of music, like hypnotic repetitions in “Spell” or jagged tangles of counterpoint in the aptly titled “Knots.” Then Mr. Ax turned to Schumann’s fantastical set of eight pieces. Playing the two works side by side, Mr. Ax emphasized the wildness, even radicalism, of the Schumann and highlighted hints of mystical Romanticism in the Benjamin. He ended with a dazzling account of Chopin’s “Andante Spianato and Grande Polonaise Brillante,” another work he has played (and recorded) to acclaim. ANTHONY TOMMASINI "
5c9e6ca149f0eacbf106a45a,https://www.nytimes.com/2019/03/29/arts/music/a-brunnhilde-is-born-the-week-in-classical-music.html,"[Read all of our classical music coverage here.] Hojotoho, and happy Friday! This week, the soprano Christine Georke brought her much-hyped Brünnhilde to the Metropolitan Opera for the opening of Wagner’s “Die Walküre,” my favorite installment of the “Ring.” Her arrival is remarkable if only because vocal troubles nearly pushed her to quit opera; you can read all about it in Michael Cooper’s profile of her:  Corinna da Fonseca-Wollheim, who reviewed “Die Walküre,” wrote that in Ms. Goerke, the Met “has found a Brünnhilde who marries vocal vitality and emotional presence in each radiant note.” I couldn’t agree more. Listen for yourself how she tosses off those howls of “Hojotoho!”  Expect more coverage of the “Ring” as the Met rolls its revival of Robert Lepage’s production. Anthony Tommasini has offered his thoughts on how Wagner’s epic always seems to be eerily resonant, especially now in this moment of divisive American politics.  But enough about Wagner (for now). Elsewhere this week, I attended the latest edition of the New York Philharmonic’s Nightcap series. These little concerts are meant to provide an intimate introduction to living composers — John Adams, in this case. The program Mr. Adams curated, however, was generous and illuminating, featuring only two of his works (“I Still Play” and “First Quartet”) to make room for ones by his younger colleagues.  So Mr. Adams presented music by people like Timo Andres — he also played the evening’s solo piano pieces — and Nico Muhly, as well as Gabriella Smith, who I hope will be heard at the Philharmonic again soon. Enjoy an excerpt from her “Carrot Revolution,” a sonically intrepid piece that has the impression of an image coming in and out of focus, joyously performed at Nightcap by the Attacca Quartet.  I was back at the Philharmonic on Wednesday for a one-night-only concert featuring Yuja Wang, as thrilling as ever, in Robert Schumann’s Piano Concerto in A minor. The great Maurizio Pollini was originally scheduled to appear, but canceled. As it happens, Ms. Wang is currently touring the work. She was mesmerizing in a performance last month with the Boston Symphony Orchestra, where she struck a Martha Argerich-like balance of commanding precision and wildness. The scales tipped slightly at David Geffen Hall this week as she opened the concerto with a fiery run of chords. Which is not to say she gave a feral performance: She never appeared out of control as she navigated the piece’s changing moods and fickle attachment to Romantic and Classical styles. For an encore, she leaned into Romanticism with one of her standbys, Liszt’s stirring transcription of the Schubert song “Gretchen am Spinnrade.”  For those following Ms. Wang’s many appearances in New York this season, she’ll next play at Carnegie Hall on April 10, where her Perspectives series continues with a recital featuring the cellist Gautier Capuçon. On the program is Rachmaninoff’s Cello Sonata in G minor, a chamber work whose dreamy sound world I’m always happy to revisit. See you there. JOSHUA BARONE If the opera world had awards like the Oscars, then in 1998 the tenor Anthony Dean Griffey would surely have won for best actor in a leading role, for his wrenching performance as the hulking, slow-witted Lennie in Carlisle Floyd’s “Of Mice and Men” at New York City Opera. (Here he is in the video above, in a 2011 production at Opera Australia.)  Mr. Griffey might even have picked up the award again in 2008, for the title role of Britten’s “Peter Grimes” at the Metropolitan Opera. His Grimes came across like a dangerously intemperate and painfully isolated man-boy.  Now a professor of voice at the Eastman School of Music, Mr. Griffey returned to New York for a recital last Sunday at the Morgan Library & Museum. He shared the program with the gifted, radiant-voiced young coloratura soprano Amy Owens (presented in collaboration with the George London Foundation). The Warren Jones was the elegant, superb piano accompanist.  Mr. Griffey brought robust sound, tenderness and his trademark crisp diction to songs by Frank Bridge, John Jacob Niles, Charles Ives and others. He paid tribute to Mr. Floyd, now 92, singing Sam’s Aria from “Susannah,” which he once performed at the Met with Renée Fleming in the title role. Mr. Griffey also expressed gratitude to André Previn, who died last month, for giving him career-changing opportunities, including casting him as Mitch in the premiere of the opera “A Streetcar Named Desire” (which also starred Ms. Fleming). Mr. Griffey then sang a wistful performance of Mitch’s revealing aria. ANTHONY TOMMASINI "
5c9635a449f0eacbf105ea84,https://www.nytimes.com/2019/03/23/arts/music/classical-music-opera-youtube-netrebko.html,"[Read all of our classical music coverage here.] Apologies, readers! You may notice that this week’s compendium has been put together and published on Saturday morning, rather than the usual Friday afternoon.  Blame the unreliable Wi-Fi on my flight back from London, where I had traveled to see the opening of Verdi’s “La Forza del Destino” at the Royal Opera House. The main draw: the show brings together Anna Netrebko and Jonas Kafumann in a staged opera for the first time since 2008. It was a particular coup for Ms. Netrebko, who gave, I wrote, “one of the performances of her career.” Comparing it with some other recent new roles, “it is a more spontaneous creation than Ms. Netrebko’s serene Aida or her stilted Tosca, with the grandeur and sorrow of her Adriana Lecouvreur and a febrility that recalls her Lady Macbeth.” Here’s a clip of her singing “Pace, pace,” the climactic aria in “Forza,” in concert in Buenos Aires last year: Lincoln Center’s Mostly Mozart Festival announced its 2019 season. Here’s our summary, and here’s the full release. Some good news out of New England: Florence Price’s music will make its debut with the Boston Symphony, five years after William Robin, writing in our pages, called the orchestra out for overlooking her. And Anthony Tommasini compared the Met’s old and new “Ring” productions when it comes to Wotan’s Narrative, perhaps the cycle’s emotional center. Here are the clips! With singing like that, I hope you’ll agree that late was better than never this week. Enjoy your weekend! ZACHARY WOOLFE On Wednesday at Zankel Hall, the vocal ensemble Theatre of Voices and its director, Paul Hillier, presented small sets of music by Arvo Pärt and David Lang. But the impact of their tour through Pärt — an assemblage of works composed in different decades — was drained of some pleasure by a video piece projected alongside it. The sedate shots of animals and skyscapes brought Mr. Pärt’s profundity (as well as the group’s singing) down to earth. The premiere of the full version of Mr. Lang’s “the writings” helped illustrate how little help musicianship of this caliber actually requires. Presented simply, without multimedia interference, Mr. Lang’s work brought the Theatre’s singers together with members of Yale Voxtet. They made a strong case for Mr. Lang’s latest cycle, which draws inspiration from the Hebrew Bible. The text of the third movement, “for love is strong,” is a long list poem of similes revolving around rooted, droning tones. And in a later movement, one could hear a chattering central vocal part that seemed influenced by Meredith Monk. But the harmonies — quickly shifting, comforting and peculiar at once — served as reminders of Mr. Lang’s individual artistry. SETH COLTER WALLS On Monday evening, the Metropolitan Opera brought back David McVicar’s handsomely efficient production of “Tosca,” with the conductor Carlo Rizzi leading a rich and exciting reading of the score. Flu season provided more excitement: On Monday afternoon, the soprano Jennifer Rowley, who was to have sung the title role, withdrew because of illness. She was replaced by Iulia Isaev, a Romanian soprano making her Met debut. With a powdery soft tone and comforting low register, Ms. Isaev was most convincing in the first act, in which we get to know Tosca as a sweet and playfully pious diva. Her flirtatious interplay with Joseph Calleja’s Cavaradossi felt alluringly natural. (He, too, was battling a cold but pulled out some stirring lines.) But the opera’s fascination stems from Tosca’s growth under pressure, as she faces the awful choice between hearing her lover tortured and submitting to a sexual bully — and then when she, with desperate clarity, kills her tormentor. Ms. Isaev never quite marshaled the power to convey that transformation. The aria “Vissi d’arte” should mark a turning point in the opera, but while Ms. Isaev’s rendition had melting sadness, in the cautious top note of the climax there was none of the bitter fire that should fuel the dramatic events to come. CORINNA da FONSECA-WOLLHEIM "
5c799a8649f0eacbf105aefc,https://www.nytimes.com/2019/03/01/arts/music/classical-music-spotify-youtube.html,"[Read all of our classical music coverage here.] Big news for opera fans: The Metropolitan Opera’s grand, classic, very traditional but very delightful production of Verdi’s “Aida” is saying farewell.  [Read about the final run of the Met’s “Aida.”] There will be just two more performances, on March 4 and 7. When the opera returns, it’ll be to open the 2020-21 season in a new staging by Michael Mayer, of the Met’s Rat Pack “Rigoletto.” (The “Aida” cast looks incredible: Anna Netrebko, Anita Rachvelishvili, Piotr Beczala and Ludovic Tézier, conducted by Yannick Nézet-Séguin.) Other things this week: — Josh Barone revisited John Adams’s recent opera “Girls of the Golden West” in Amsterdam. — Accusations of bullying threaten Daniel Barenboim’s previously sacrosanct position in the Berlin music scene. — Nate Wooley makes amazing music. — Hear seven of the best works from the middle of the last century, a sadly neglected period in American music. — Reviews of “Falstaff” at the Met, a virtuosic pianist and the tenor Matthew Polenzani. (Gotta love a singer who programs Janacek’s “Diary of One Who Disappeared.”) In a tweet, the composer Nico Muhly yanked me in the direction of Alexandre Tharaud’s recording of Rameau keyboard works, which I listened to and promptly recommended to everyone I know. You need to hear this strange and glorious recording! Enjoy the weekend. ZACHARY WOOLFE As if the list of stellar pianists still in their 20s and early 30s weren’t long enough, here’s another name to add to it. Beatrice Rana, 26, should probably already be on the list, to be fair, with a handful of strong recordings including a “Goldberg” Variations that I named as one of the releases of the year in 2017.  But she’s only now making her way around the recital circuit, with a debut to come on March 12 at Carnegie Hall. I heard the program she’ll play there this past Wednesday, as part of the Celebrity Series of Boston. Agosti’s transcription of Stravinsky’s “The Firebird” had all the virtuosic flair that you’d expect, but never for its own sake; Ravel’s “Miroirs” were as polished as pearls, each blessed by uncommon sensitivity of touch; and if I was never quite convinced by her meditative take on Chopin’s Op. 25 Études, it always intrigued. One to watch. DAVID ALLEN "
5c8c730c49f0eacbf105d64e,https://www.nytimes.com/2019/03/15/arts/music/classical-music-youtube.html,"[Read all of our classical music coverage here.] Hope you had a bustling week and are looking forward to some adventurous listening this weekend.  In memory of Michael Gielen, the searching conductor who died last Friday at 91 — read David Allen’s superb obituary — hear one of the selections David chose: Beethoven’s “Missa Solemnis,” rendered with cleareyed power. Listen as you go about chores, or take the subway, or drive to the bank. You’ll be glad you did. On Wednesday, I was at the Metropolitan Opera for the return of “Samson et Dalila” with a fresh cast — notably the galvanizing mezzo-soprano Anita Rachvelishvili.  It was clear from the start that the Samson, Aleksandrs Antonenko, was struggling; after intermission, the Met announced that he was ill with a cold, and would be replaced by Gregory Kunde. It’s not easy to jump into the middle of a performance, but Mr. Kunde did it with stylish ease. Now 65(!), he’s moved on from specializing in bel canto earlier in his career to the heroic roles of Verdi and Puccini. But he’s hardly ever sung at the Met. Hopefully that changes now. His success brought me back to an already classic recording of Rossini’s “Armida” made from 1993 performances in Italy. Here’s Mr. Kunde combining memorably with Renée Fleming: This week our critics reviewed the return of “Das Rheingold” to the Met; the New York recital debut of the pianist Beatrice Rana; the umpteenth Carnegie concert by the great violinist Anne-Sophie Mutter; and two concerts from Esa-Pekka Salonen and the Philharmonia Orchestra of London. In darker news, the musicians of the Chicago Symphony have gone on strike, largely over proposed changes to their pension plan. And Christine Goerke spoke with Michael Cooper about taking on Brünnhilde at the Met, where she was once in the young artists program. “I think if you talk to anyone who’s ever been a young artist in any house, it’s always hard to come back and feel like a grown-up,” she said. “I’m going to be 50, and I still feel like I’m 24.” Enjoy the weekend! ZACHARY WOOLFE The night after Beatrice Rana’s New York debut, on the same stage (Zankel Hall), the fun was doubled in a fascinating program of exciting works for two pianos, performed by the formidable Kirill Gerstein, who can play anything, and Thomas Adès, an eminent composer who is also accomplished pianist.  Recently they were with the Boston Symphony Orchestra for the premiere of Mr. Adès’s Piano Concerto, written for Mr. Gerstein. (They bring that work to Carnegie Hall on Wednesday.) At Zankel, they began with Debussy’s “En Blanc et Noir,” a late work, from 1915, which in this starkly beautiful and steely performance seemed not far removed from the shock-and-awe radicalism of Stravinsky’s “The Rite of Spring” (1913).  Turning to Stravinsky, they played Shostakovich’s rarely-heard arrangement of the “Symphony of Psalms.” With the chorus part (a setting of psalm texts) divided between the pianos — and without the distraction, so to speak, of the score’s dark, percussive orchestral sonorities — the modernist daring of Stravinsky’s harmonic language came through stunningly. The program also included Mr. Adès’s stream-of-consciousness Concert Paraphrase from his opera “Powder Her Face,” and ended with an account of Ravel’s “La Valse” that had this showpiece sounding dangerous. Don’t believe me? Here they are playing it in Paris in 2016. ANTHONY TOMMASINI "
5cafab3149f0eacbf1f8314b,https://www.nytimes.com/2019/04/11/arts/music/nyc-this-weekend-classical-music.html,"Our guide to the city’s best classical music and opera happening this weekend and in the week ahead. JACK QUARTET at the Morgan Library & Museum (April 14, 3 p.m.). Accomplishing quite the feat of modern music, this indefatigable foursome plays the five complete quartets of Elliott Carter, a body of music stretching from 1951 to 1995. 212-685-0008, themorgan.org JUILLIARD415 at the Cathedral Church of St. John the Divine (April 16, 7:30 p.m.). For Holy Week, the seven movements of Haydn’s “The Seven Last Words of Christ” are paired with companion commissions by the contemporary composers Jessica Meyer, Colin Jacobsen, Nico Muhly, Tania León, Reena Esmail, Paola Prestini and Caroline Shaw. 212-799-5000, juilliard.edu DAVID T. LITTLE at Miller Theater (April 18, 8 p.m.). Little is perhaps best and deservedly known for his operas, including “Dog Days” and “JFK,” so this composer portrait is a welcome opportunity to hear some of his instrumental music. Not that the music to be played here sets aside the political approach that he has taken in so much of his work. “Haunt of Last Nightfall,” for percussion quartet and electronics, takes its story from the 1981 El Mozote massacre in El Salvador by soldiers trained by the United States military; “AGENCY,” for string quartet and electronics, is a work about secrecy, itself written using ciphers. Third Coast Percussion and the American Contemporary Music Ensemble are on hand to perform. 212-854-7799, millertheatre.com [Read about the events that our other critics have chosen for the week ahead.] LONDON PHILHARMONIC ORCHESTRA at David Geffen Hall (April 14, 3 p.m.; April 15, 8 p.m.). A doubleheader from this solid British ensemble, led by the conductor Edward Gardner, albeit with distinctly routine programs. On Sunday, they perform Debussy and Ravel, including Ravel’s Piano Concerto, with Jean-Efflam Bavouzet at the keyboard; on Monday, Beethoven’s “Egmont” Overture, Sibelius’s Violin Concerto with James Ehnes, and Mahler’s Symphony No. 1. 212-721-6500, lincolncenter.org ORCHESTRA OF ST. LUKE’S at Carnegie Hall (April 18, 8 p.m.). Pablo Heras-Casado, the former principal conductor of this ensemble, reflects on Classicism and Neo-Classicism in this program, with Prokofiev’s Symphony No. 1, Stravinsky’s Suite No. 1 for small orchestra, Haydn’s Symphony No. 103 and Ravel’s Piano Concerto, with Hélène Grimaud as the soloist. 212-247-7800, carnegiehall.org ‘SEMELE’ at Carnegie Hall (April 14, 2 p.m.). The English Concert’s annual performances of Handel oratorios and operas at Carnegie, under Harry Bicket, have been surefire hits for the past several years. Brenda Rae sings the title role, alongside Elizabeth DeShong, Soloman Howard, Benjamin Hulett, Ailish Tynan and the Clarion Choir. 212-247-7800, carnegiehall.org ‘SIEGFRIED’ at the Metropolitan Opera (April 13, 11:30 a.m.). The “Ring” moves apace with the third installment of Wagner’s cycle. Christine Goerke continues as Brünnhilde, with Stefan Vinke as Siegfried, Michael Volle as the Wanderer, Tomasz Konieczny as Alberich, Gerhard Siegel as Mime, Dmitry Belosselskiy as Fafner, Karen Cargill as Erda and Erin Morley as the Woodbird. Philippe Jordan conducts. The performance repeats during complete runs of the cycle starting in late April and early May; devotees of voice will note the appearance by the leading Wagner tenor of our time, Andreas Schager, in this opera on May 2. 212-362-6000, metopera.org "
