,0,1
5c3f8d473a125f5075c04c4e,https://www.nytimes.com/2019/01/16/books/review/birth-of-loud-ian-port.html,"THE BIRTH OF LOUD Leo Fender, Les Paul, and the Guitar-Pioneering Rivalry That Shaped Rock ’n’ Roll By Ian S. Port Illustrated. 340 pp. Scribner. $28. Like a lot of paradigm-shifting inventions, the solid-body electric guitar seems inevitable in hindsight. Someone was bound to realize that a steel string could be hugely amplified by a magnetic pickup and an external speaker, blasting an electronic signal. Someone was bound to come up with a design that felt familiar and comfortable to a working musician. And someone would certainly figure out how to manufacture the instrument as an affordable mass-market commodity. But the actual advent of the solid-body electric guitar, sometime in the 1940s, was a tangled tale of tinkerers, craftsmen, musicians and businessmen who hardly realized what they had unleashed. In “The Birth of Loud,” Ian S. Port, a critic and guitarist who was the music editor for The San Francisco Weekly, has sorted out the facts of the electric guitar’s much-mythologized genesis and cultural conquest. He turns them into a hot-rod joy ride through mid-20th-century American history. With appropriately flashy prose, he dismantles some misconceptions and credits some nearly forgotten but key figures. He also summons, exuberantly and perceptively, the look, sound and sometimes smell of pivotal scenes and songs. Port frames his scrupulously sourced narrative with two thoroughly disparate characters who converged on the same idea and have archetypal guitars bearing their names: Les Paul and Leo Fender. “Their personalities and worlds were as far apart as any in music could be: One’s arena was primarily the stage, the other’s, the workbench,” Port writes. Clarence Leo Fender was a perpetually rumpled, unassuming, self-taught radio repairman, an intuitive engineer and non-musician who decided to build guitars and amplifiers. “His enjoyment of the instrument,” Port writes, “stemmed from the precise pattern of harmonics produced by its strings. Where others heard music, Leo Fender heard physics.” Lester Polsfuss, a.k.a. Les Paul, was a world-class guitarist and self-promoting showman who was also a technological visionary, fascinated by electronics and studio production. “Les Paul wrestled with the knowledge that even being a virtuoso on the guitar would not bring the fame he craved,” Port writes. “Les now began to see his guitar playing as one element in a larger project: a whole new sound that would combine his brilliant musicianship, the pure electric guitar tone he wanted, and radical new recording techniques he envisioned.” The electric guitar was no single individual’s invention. Amplified guitars had appeared in the early 1930s, when companies including Gibson and Rickenbacker put pickups inside acoustic guitars to play them through amplifiers. Yet beyond a certain volume, amplified sound waves bouncing around inside a traditional guitar’s hollow body would create screaming feedback. But that problem had been solved by a different instrument: the Hawaiian or steel guitar, distilled down to just strings, a neck and pickups heard through an amplifier. They were played horizontally, as a lap steel guitar, or built into a tabletop with pitch-shifting pedals as country music’s pedal steel guitar. Concentrating on Fender and Paul, Port mentions but doesn’t explore the groundbreaking solid-body lap steel guitar sold by Rickenbacker in the early 1930s or other short-lived, solid-body six-string guitar progenitors. In the mid-1940s, Fender turned his radio repair shop into the Fender Electric Instrument Company, manufacturing steel guitars and amplifiers. Both he and Paul had been thinking about a solid-body electric guitar. Les Paul built one for himself in 1940 out of a 4-by-4 plank and an existing guitar neck. He called it “the Log,” performed with it (adding the sides of a guitar body) and brought it to the Gibson company in the early 1940s as a potential product. “After Les left,” Port writes, “the managers chortled among themselves about that crazy guitar player who wanted Gibson to build a broomstick with pickups on it.” In 1943 Fender and a collaborator put pickups on a solid oak plank and shaped it like a narrow little guitar. They built only one rough model, but for years they rented it out steadily to local musicians who loved the amplified sound. It was, Port writes, “a misfit stepchild of a guitar that extended creative expression past what any other standard model allowed.” Neither Fender nor Paul got past his prototype until the 1950s. While Fender struggled to keep his existing factory in business, Paul was thriving as a musician, backing Bing Crosby and others. Paul had turned his Hollywood garage into a home studio: a magnet for musicians and a place to experiment with recording technique. At Les Paul’s studio, Fender, Paul, and a designer and meticulous custom-instrument craftsman named Paul Bigsby brainstormed a solid-body guitar, consulting with musicians. One was the country music star Merle Travis, a Bigsby client. Travis dared the designer to build him a thin, solid-body electric, sketching it in detail. Bigsby built it in 1948. Fender studied it, but knew it was too luxurious. He came up with something simpler, eliminating fine woodworking and its sculptural glued-on neck; his neck was bolted on and easily replaceable, for a guitar that could be manufactured, affordable and practical. “This was the leap from classical design to modernism; from the age of walnut to the age of celluloid; from the America of brick-and-iron cities to the America of stucco-and-glass suburbs,” Port writes. Fender unveiled a solid-body six-string in 1950 and was backlogged with orders by 1951. That was the year Paul’s pop career skyrocketed. In a duo with his wife, the singer and guitarist Mary Ford, Paul used his multitrack studio to create giddy, futuristic, chart-topping versions of standards like “How High the Moon.” The venerable Gibson company had quietly been developing its own solid-body guitar, with a more elegant shape, advanced pickups and smoother sound than the twangy Fender Telecaster. Although Paul didn’t design it — a myth Gibson cultivated — he tweaked it slightly and lent his mad-scientist credibility to the Les Paul Model, Gibson’s first solid-body electric guitar. Meanwhile, Fender came up with the Stratocaster, a curvy, seductive shape contoured to a player’s body. The competition was on, joined by other companies. Leo Fender had another far-reaching idea, introduced in 1952: an electric bass guitar that was far more portable, louder and crisper than a classic bass fiddle. And as rock ’n’ roll took over popular music, he met the demand for bigger, louder amps — including one that deafened him in one ear while he was repairing it for the surf-rock guitarist Dick Dale — and for effects, like reverb, that separated the electric guitar even further from its acoustic ancestors. Musicians took it from there. Electric guitars increasingly defined rock ’n’ roll, driving out pianos and horn sections. Guitarists cranked up and dirtied up the clean, warm sounds that Fender and Paul had tried to engineer; Jimi Hendrix embraced feedback with a vengeance. (His 1969 Woodstock Festival rendition of “The Star-Spangled Banner” gets its own, climactic chapter of Port’s book.) The synergy of guitars, amplifiers and effects spawned new idioms, while manufacturers’ profits rose and fell with hit makers’ equipment choices. The latter part of “The Birth of Loud” juxtaposes breakthroughs by musicians — Muddy Waters, Eric Clapton, Hendrix, the electric bass players Carol Kaye and James Jamerson — with the up-and-down individual and corporate fortunes of Fender and Paul. Fender sold his company in the mid-1960s, but kept tinkering with other companies. Paul saw his pop style eclipsed by rock ’n’ roll and his namesake Gibson model discontinued, only to have his guitar resuscitated by British blues-rockers and his playing eventually cherished by jazz fans. In the digital era, guitars no longer rule popular music. Port recognizes that Paul left another, perhaps larger legacy: He was “the first player to claim the studio as an instrument, a move so common today that we often forget to remark on it. Les aimed to control not only the music that went onto the canvas of recorded sound, but everything about the canvas itself: the framing, the immaculateness of the background, the depth and layering of the sounds, and where it hung on the viewer’s wall.” But “The Birth of Loud” rightfully celebrates an earlier time, when wood, steel, copper wire, microphones and loudspeakers could redefine reality. Tracing material choices that echoed through generations, the book captures the quirks of human inventiveness and the power of sound. "
5c6e180e3a125f5075c0ab59,https://www.nytimes.com/2019/02/20/arts/who-is-jussie-smollett.html,"The “Empire” star Jussie Smollett, who was charged on Wednesday with staging a racist and homophobic attack on himself in Chicago last month, has been under a bright spotlight in recent weeks — but perhaps not for reasons that a career actor and singer would prefer. Mr. Smollett, who is black and openly gay, reported in January that he was the victim of an attack during which masked men poured chemicals on him and put a noose around his neck, prompting an outpouring of support from fans, activists and politicians. In a major twist, Mr. Smollett, who is in his mid-30s, was charged Wednesday with a felony count of disorderly conduct in connection with the episode. Mr. Smollett is best known for his acting role on “Empire,” a hip-hop drama on Fox, in which he plays a son vying for the throne of his father’s music empire. Growing up with five siblings pursuing careers in acting, modeling and music, Mr. Smollett first appeared on the big screen in 1992. He has landed supporting roles in several other films and television shows since, while also beginning a career as an R&B singer. [Here’s a timeline of what has transpired since Mr. Smollett reported the attack.] “Empire,” which finished its fifth season last year, follows a former drug dealer turned hip-hop mogul, Lucious Lyon, whose three sons must compete to run his multimillion-dollar company. Mr. Smollett’s character, Jamal Lyon, is a gay singer-songwriter who starts the series estranged from his father because of his sexuality. Mr. Smollett sings in and has written for the soundtrack of the series. As a child, Mr. Smollett landed a role in the family comedy film “The Mighty Ducks,” about a lawyer who must coach a youth hockey team after he was sentenced to community service. Two years later, Mr. Smollett starred with five of his brothers and sisters in an ABC sitcom called “On Our Own,” about siblings who are orphaned after their parents die in a car accident. Mr. Smollett’s younger sister, Jurnee Smollett-Bell, has grown up to make her mark in the acting world as well. She is one of the leads in “Underground,” a WGN America show about a group of slaves who try to escape from their Georgia plantation. Mr. Smollett is a guest star on the show. In 2017, Mr. Smollett appeared in the science-fiction thriller “Alien: Covenant.” That year, he also played Langston Hughes in the film “Marshall,” a biopic about Thurgood Marshall, the first African-American Supreme Court justice. Mr. Smollett and his siblings have been outspoken politically and devoted to causes like H.I.V./AIDS prevention and racial justice. Mr. Smollett sits on the board of four charity organizations, including the Trayvon Martin Foundation and the Black AIDS Institute, according to his website. Mr. Smollett also has a singing career separate from “Empire.” Last March, he released a 10-song R&B album. Days after he reported the attack, Mr. Smollett performed for a sold-out crowd in West Hollywood, Calif., telling his fans that he would not let his attackers win and that he “had to be here tonight.” Mr. Smollett told the police in January that, while walking in downtown Chicago, he had been confronted by masked white men who directed homophobic and racial slurs at him and announced it was “MAGA country,” a reference to President Trump’s campaign slogan. As Mr. Smollett has faced questions about whether his hate crime report was truthful, he has continued to insist that the incident occurred just as he reported it. In a statement released by Fox on Wednesday, before the Chicago police labeled Mr. Smollett a suspect in the case, the network said his character was not being written out of “Empire” in response to the police’s announcement that the trajectory of the investigation had changed, contrary to reports from multiple news outlets. Fox later declined to comment after Mr. Smollett was charged. On Wednesday night, following his indictment, his lawyers said in a statement, “Like any other citizen, Mr. Smollett enjoys the presumption of innocence, particularly when there has been an investigation like this one where information, both true and false, has been repeatedly leaked.” "
5c536fee3a125f5075c0767f,https://www.nytimes.com/2019/01/31/arts/music/pop-rock-and-jazz-in-nyc-this-week.html,"Our guide to pop and rock shows and the best of live jazz happening this weekend and in the week ahead. AMEN DUNES at Warsaw (Feb. 1, 9 p.m.). To rehash bluesy rock in a way that’s genuinely compelling is a serious challenge, but Damon McMahon, frontman of Amen Dunes, has found his own way down that oft-trodden path. Especially on the band’s latest album, “Freedom,” there’s a refreshing restraint to their work, stripping away most of rock’s maximalism in favor of gentle, reverb-laden riffs that spotlight McMahon’s distinctive, ever-so-slightly wavering voice. The result is pleasant, mild chaos with enough familiar sounds to be an easy listen. The electronic artist Arthur opens. 212-777-6800, mercuryeastpresents.com/warsawconcerts TONI BRAXTON at Kings Theater (Feb. 7, 8 p.m.). This R&B titan takes over the cavernous theater in Flatbush, Brooklyn, for a show that has long been sold out (though tickets are available via resellers). Braxton specializes in dramatic, emotional epics, songs that are practically operatic in scope; her most enduring hit is “Un-Break My Heart,” a sweeping power ballad. Most remarkable, though, is that Braxton’s style has remained constant in spite of shifting R&B trends. Her 2018 album “Sex & Cigarettes,” a collection of cathartic, unrelenting songs about infidelity, earned three Grammy nominations. The trio SWV, responsible for chart toppers such as “Weak” and “Right Here,” will also perform. 718-856-5464, kingstheatre.com ESTELLE at Baby’s All Right (Feb. 6, 8 p.m.). This British singer’s 2008 major-label debut is best known for its smash hit “American Boy,” which features Kanye West as her raffish suitor. The release had another minor hit, though: “Come Over,” a pop-reggae song featuring Sean Paul. Estelle, whose father is from Grenada, revisited reggae and dancehall on her most recent record, 2018’s “Lover’s Rock” — a tribute to the buoyant, romantic British reggae subgenre that goes by the same name. The album, released on the legendary reggae label VP Records, features heavy hitters including Chronixx, Tarrus Riley and Konshens. 718-599-5800, babysallright.com SHAMIR at Brooklyn Bazaar (Feb. 2, 8 p.m.). Pinning a genre to this singer-songwriter from Las Vegas is challenging. His 2015 debut, “Ratchet,” is eclectic synth-pop with 1980s flair; his latest, last year’s “Resolution,” is stripped-down indie rock that includes songs like “I Can’t Breathe,” which focuses on police killings, and “The Things You Loved,” which has a folksy twang. There are constants, though: Shamir’s instantly identifiable voice — high and sweet with an acidic edge — and his songwriting. Even as his sound becomes more rough-hewed, his songs remain taut and compelling.bkbazaar.com TIBET HOUSE US BENEFIT CONCERT at Carnegie Hall (Feb. 7, 7:30 p.m.). For the 32nd year in a row, Tibet House US, an organization devoted to preserving Tibetan culture and protecting its refugees, will host an all-star musical benefit. This year’s edition, curated by Philip Glass, a longtime participant, includes Laurie Anderson, Jon Batiste, Debbie Harry, Jason Isbell, Angelique Kidjo, Nathaniel Rateliff, New Order’s Bernard Sumner and the Tibetan artist Tenzin Choegyal. Stephen Colbert will be on hand for comic relief. And surprise one-off collaborations are likely; last year, Patti Smith and Angel Olsen covered the Velvet Underground’s “I Found a Reason.” 212-247-7800, carnegiehall.org TRIBALISTAS at the Hammerstein Ballroom (Feb. 5, 8 p.m.). The singers Arnaldo Antunes, Marisa Monte and Carlinhos Brown were already stars in Brazil before joining forces to record their 2002 album, “Tribalistas.” A collection of lilting songs in the tradition of what’s known as “musica popular brasileira” — a post-bossa-nova movement dedicated to integrating international sounds into Brazilian music — the album boosted the supergroup to international success, selling over three million copies globally. It took 15 years for the trio to release a follow-up, also simply called “Tribalistas”; now, they’re performing in New York for the first time as a group.800-745-3000, mc34.com [Read about the events that our other critics have chosen for the week ahead.] YOLA at Rockwood Music Hall, Stage 2 (Feb. 6, 7 p.m.). Country-soul seems overdue for some mainstream attention, thanks to the parallel success of old-school singers like Leon Bridges and Charles Bradley, and outlaw-era-inspired country stars like Chris Stapleton and Miranda Lambert. Yola, whose Southern soul sound belies her upbringing in southwest England, is as good a candidate as any to spark such a renaissance. Her rich alto fits in seamlessly alongside the slide guitars, jangling piano and lush arrangements on her upcoming debut, “Walk Through Fire,” produced by the Black Keys’ Dan Auerbach.212-477-4155, rockwoodmusichall.comNATALIE WEINER J. D. ALLEN QUARTET at Smoke (Feb. 1-2, 7, 9 and 10:30 p.m.). One of today’s premier tenor saxophonists, Allen spent the last decade working with a steady trio, developing a sturdy but flexible sound based around minor melodies and bristling postbop rhythms. But he recently assembled a new trio featuring a couple of younger musicians, the bassist Ian Kenselaar and the drummer Nic Cacioppo. The early returns are good: An appearance at Winter Jazzfest, where the new trio was joined by the tenor saxophone luminary David Murray, showed how ably the young players have adapted to Allen’s personal style. This weekend the group performs with another of Allen’s frequent collaborators: the crisply expressive guitarist Liberty Ellman.212-864-6662, smokejazz.com JIMMY COBB at Jazz Standard (Jan. 31-Feb. 3, 7:30 and 9:30 p.m.). Cobb, a drummer and National Endowment for the Arts Jazz Master, will probably be remembered as the drummer whose crackling ride cymbal adorned Miles Davis’s 1959 classic, “Kind of Blue.” But his career is much bigger than that one date: He accompanied Sarah Vaughan and John Coltrane and Freddie Hubbard, playing on countless record dates and remaining in the top tier of New York jazz for over 60 years. Cobb turned 90 in January, and he celebrates this weekend in a quartet featuring Peter Bernstein on guitar, Tadataka Unno on piano and John Webber on bass.212-576-2232, jazzstandard.com PEDRO GIRAUDO TANGO QUARTET AND SOFIA TOSELLO at Joe’s Pub (Feb. 1, 9:30 p.m.). Giraudo is an Argentine bassist and composer who reinforces his love for tango with a mastery of Western classical and jazz vocabulary. He sometimes performs with a full orchestra, but he’s just as dazzling with his quartet — the group that appears on his 2018 album, “Vigor Tanguero,” which won a Latin Grammy for best tango album. Also on the bill is Sofia Tosello, a vocalist whose last album, “Lluvia Fue” (“Chamber Tango”), presents its own distinctive take on the tango tradition, mixing old songs and new.212-967-7555, publictheater.org MARÍA GRAND QUARTET AND JOEL ROSS GOOD VIBES at Dizzy’s Club Coca-Cola (Feb. 5, 7:30 and 9:30 p.m.). Grand, a tenor saxophonist, and Ross, a vibraphonist, are two of the most-buzzed-about young players on the New York jazz scene — each with their own sleek, sanguine take on mainstream jazz. They’re also frequent collaborators, and at Dizzy’s on Tuesday they will split the bill, with Grand’s quartet (the vocalist Fay Victor, the bassist Kanoa Mendenhall and the drummer Savannah Harris) starting things off, and Ross’s group (Mendenhall on bass, Immanuel Wilkins on alto saxophone, Jeremy Corren on piano and Jeremy Dutton on drums) playing the second set. Tickets for each performance are sold separately.212-258-9595, jazz.org/dizzys HYPNOTIC BRASS ENSEMBLE at the Blue Note (Jan. 31-Feb. 3, 8 and 10:30 p.m.). The brass-band tradition is naturally associated with New Orleans, but Hypnotic proudly espouses its Chicago roots. With less marching-band thunder and more hip-hop swagger than, say, New Orleans’s Dirty Dozen Brass Band, this eight-piece ensemble mixes the influence of hip-hop, soul and gospel into a coolly grooving sound. And Chicago’s deep legacy as a cradle of experimental, Afrocentric jazz is never far away: All but one of Hypnotic’s members is a son of Kelan Philip Cohran, a patriarch of Chicago’s creative black music scene, who died in 2017.212-475-8592, bluenote.net EIVIND OPSVIK OVERSEAS AND SNARK HORSE at Nublu 151 (Feb. 6, 9 p.m.). A Norwegian-born bassist with a big, dark tone and precision chops, Opsvik writes music with an irreverent intensity, adhering to no single style and showing little interest in the mannered formality of so much progressive jazz. Much of his latest album, the fifth installment of his “Overseas” series, boasts the rugged conviction of rock music and the tangled melodic momentum of a fugue. At Nublu 151, he shares the bill with Snark Horse, an all-star group of improvisers playing short, nervous melodies that they repeat and deconstruct. Snark Horse appears here in quartet form with Matt Mitchell on piano, Ava Mendoza on guitar, Matt Nelson on tenor saxophone and Kate Gentile on drums.nublu.netGIOVANNI RUSSONELLO "
