,0,1
5c77bf8f49f0eacbf105a9e4,https://www.nytimes.com/2019/02/28/business/car-racing-country-clubs.html,"Some people like to hit the links; others would rather do laps. For those affluent people who feel that a great drive involves a Porsche instead of a tee time, a different breed of country club is eager to cater to their hobby. In a 2017 piece for Automotive News, Robert A. Lutz, the outspoken retired auto executive, lamented the inevitability of driverless cars. “Automotive sport — using the cars for fun — will survive, just not on public highways,” he said. “It will survive in country clubs such as Monticello in New York and Autobahn in Joliet, Ill. It will be the well-to-do, to the amazement of all their friends, who still know how to drive and who will teach their kids how to drive.” The precision of this forecast will take time to establish, but well-to-do collectors do in fact have some deluxe clubs where they can store and drive their cars. Monticello Motor Club in Sullivan County, N.Y., is indeed a country club. Founded in 2008, it has more than 470 members who paid an initiation fee from $60,000 to $95,000, with annual dues of $5,900 to $13,900. Family and corporate memberships for five are $135,000 with dues of $20,700. It’s not for the light of pocketbook. Membership buys access to Monticello’s 4.1-mile racetrack, a karting track and off-road trails. A professional racing instructor — like a country club’s golf pro — is on hand to sharpen skills. The membership includes many families, and children as young as 13 can learn to drive mildly tuned racecars. The club’s website says this makes them better licensed drivers. Gold members get more track time and other perks, including garage rental priority. A service center provides repair and tuning of members’ automobiles. Club activity centers on amateur competition on the racetrack. A five-event racing series concludes with one member being named champion. A clubhouse at trackside offers dining, bar service, locker rooms and more. A helipad is provided for those who like to drop in after a hard day in the corporate boardroom. Lisa and Greg Coakley and their children, Brooke and Brent, are Monticello members and racers. Mr. Coakley is a Porsche Club of America national champion, and he and his wife teamed up to win the Monticello 90-minute enduro last year in their twin Porsche Caymans. That would be quite an achievement for any couple, but for the Coakleys it’s remarkable. Mr. Coakley was born with cystic fibrosis — a condition that is often fatal — and received a double lung transplant in 2013. “Greg’s medical challenges and the gift of life we experienced changed our perspective,” Mrs. Coakley said. “We now live without limits.” She added: “Like the transplant procedure, racing requires a devoted team. In both instances, we’ve been supported by the best of the best.” The children get track time as well. Brooke, 15, drove a Spec Miata for three years and will race a Mazda in Global MX-5 Cup competition this year. Brent has been driving karts but is now 13 and will get behind the wheel of a Spec Miata. The Coakleys travel to the club from the Jersey Shore, but for those who wish to visit with minimal travel, nearby Motor Club Estates offers lavish homes with attached garages that store up to 20 cars. The developer, Michael Watkins, said that many were equipped with lifts and that one had a paint booth and machine shop. A private road takes residents to Monticello. Mr. Watkins, a member, races a Spec Miata and was 2018 club champion. “Monticello is a spectacular place with a country club atmosphere,” he said. The owners, Ari Straus and Paul Queally, he added, “are terrific people who love motorsports and race with us.” While Monticello is among the most expensive of this new breed of automotive country clubs, others are positioned to attract those of slightly more modest means. Just outside Detroit is M1 Concourse, an 87-acre playground for car lovers. Private garages, from 507 to 4,800 square feet, are the main attraction. Sold as deeded condominiums, they’re well insulated, protected with sprinkler systems and wired for cable television and high-speed internet. The garage condos are delivered in basic form, but most owners elaborately finish and equip them. Many include a loft above the garage space with a lounge and a kitchen. Most offer a view of M1’s private racetrack. To gain access to the track, garage condominium owners must join the Motorsports Club. The initiation fee is $20,000, and annual dues are $4,000. Bill Golling owns one of the larger garage condos, and it’s equipped to serve as a home away from home, with storage for 10 of his 25 automobiles, a kitchen, an entertaining area and more. Mr. Golling owns several Fiat Chrysler dealerships, so his cars are largely from that automotive group. Among those garaged at M1 are Vipers, an Alfa Romeo and an 840-horsepower Dodge Demon. Although he has plenty of power on tap and is a Motorsports Club member, Mr. Golling doesn’t drive on the track. He’s more into socializing. “It’s a car community,” he said. “I know my M1 neighbors, and we get together socially. At Halloween, we did ‘trunk or treat’ at the garages for the kids. “I’ve loved cars all my life, so it’s great to be part of a motorsports community, a place where I can play with my hobby and visit friends,” he added. “I have a great view of the track from my garage and can watch all that is going on.” The 1.5-mile racetrack winds its way past the garages and around the site. While it lacks the width and runoffs necessary for wheel-to-wheel racing, M1 stages a race-the-clock event every year. Brad Oleshansky, a co-owner and founder of M1 Concourse, said: “My mission was to have my own garage, something that could be used as a man cave in a community of like-minded enthusiasts. Driving clubs are a trend, and they’ll continue to grow.” Automotive country clubs are at least a mini trend, and they’ve sprung up in other areas where there’s a strong automotive community as well as the right space. In Dawsonville, Ga., the Atlanta Motorsports Park says it is a “motorsports club and motorsports playground where family, friends and businesses come together to share and celebrate their passion for driving.” And drive they do. The facility includes a 16-turn, two-mile road course by Hermann Tilke, a racetrack designer who has built Formula One tracks. The circuit here includes an F1 caution light system and steep elevation changes. Driver training is offered to prepare members for competition. Eight club races for Spec Miatas, BMW E30s and Radical sports cars were held in 2018. A karting circuit provides tamer fun with events open to anyone over 5 years old. Off-road trails provide additional motorized entertainment. Like M1 Concourse and Monticello, the Atlanta park offers luxury garages in various sizes and configurations. They can be purchased finished, or members can design their unit. A variety of membership packages are offered. Initiation fees range from $10,000 to $47,500. Access fees and monthly dues apply at some levels. Mark Basso, the founder and chief executive of the Autobahn Country Club in Illinois, said: “My parents belonged to a golf club. As a young car guy, I wondered why there was nothing like that for people like me.” In the 1990s Mr. Basso decided to do something about it and developed a business plan for what would become the nation’s first purpose-built motorsports country club. After years of searching for a site and a community that would welcome the venture, he opened Autobahn in 2005. About 45 miles southwest of downtown Chicago and with commercial neighbors, it has prospered. Autobahn’s main attraction is a 3.56-mile track that can be subdivided into 2.1-mile and 1.5-mile circuits. A variety of racing series provide wheel-to-wheel fun. Also available are off-road trails and a roughly half-mile kart track. Instructors provide driving lessons, and a service center offers racecar maintenance, repair, tuning and more. Vehicle storage is available in garage condominiums that store six cars on a 1,250-square-foot first floor. A second floor features bedrooms and a party room. Private lots of one-third of an acre surround the site. There, members have built what Mr. Basso calls garage mahals — elaborate structures that combine living quarters and garages. One is owned by Bobby Rahal, the former race car driver. Like other automotive country clubs, Autobahn offers a range of social activities. Membership comes at a price, although it is more modest than at some other clubs. The initiation fee is $40,000, and annual dues are $5,250. Social memberships that don’t include full access to track activities are offered for $4,200 a year with no initiation fee. "
5cafbd0149f0eacbf1f831dc,https://www.nytimes.com/2019/04/11/obituaries/earl-thomas-conley-dead.html,"NASHVILLE — Earl Thomas Conley, one of the most popular and prolific country singers of the 1980s, died here on Wednesday. He was 77. Carole Scates, his partner for more than 20 years, said the cause was cerebral atrophy. Mr. Conley had 24 Top 10 country singles in the ’80s, several of which he wrote or co-wrote, including 18 that reached No. 1. Only two artists that decade topped the country charts more times than he did: the vocal group Alabama, which had 27 No. 1 singles, and the singer Ronnie Milsap, who had 23. All but one of Mr. Conley’s No. 1 hits were recorded for RCA, starting with “Somewhere Between Right and Wrong” in 1982. Many of Mr. Conley’s songs, among them “Holding Her and Loving You” and “Don’t Make It Easy for Me,” both No. 1 hits, plumbed the complexity of romantic relationships. Abounding with sincerity, his rich, smoky baritone was well suited to his material, which appealed primarily to adult audiences, much like the vintage country and soul music of the 1960s and ’70s. Mr. Conley’s affinity for soul music was evident on many of his recordings, maybe nowhere as much as on “Too Many Times,” a 1986 duet with Anita Pointer of the Grammy Award-winning Pointer Sisters. That record reached No. 2 on the country chart and earned Mr. Conley an invitation, rare for a country artist, to perform the song with Ms. Pointer on the R&B-themed television show “Soul Train.” “There was such soul in everything he did,” Joe Galante, who was chief executive of RCA Nashville from 1982 to 1990, said in an interview with The Daily Tennessean. “You always talk about finding something unique,” Mr. Galante continued. “His voice certainly was that.” Mr. Conley placed an average of two singles a year on the country charts in the 1980s, on his way to becoming an inspiration to future country hitmakers like Randy Travis and Blake Shelton. By the early ’90s, with the rise of new stars like Garth Brooks and Shania Twain, sales of Mr. Conley’s records had dropped, and he received less and less airplay, prompting him to take an extended break from touring and recording. He resurfaced again in 1998, and, though he never achieved the kind of success he had in the ’80s, he was active into this decade. Earl Thomas Conley, the third of eight children, was born on Oct. 17, 1941, in Portsmouth, Ohio, a small town across the Ohio River from Kentucky, to Ruth (Davis) and Arthur Conley. When his father lost his job with the railroad, Earl, then 14, moved in with one of his older sisters. He was offered a scholarship to attend art school but opted instead to join the Army, where he first began writing songs and singing in public. After his discharge, Mr. Conley worked for the railroad and in steel mills while traveling to and from Ohio and Nashville to write songs with the producer Dick Heard. Their song “Smokey Mountain Memories” became a Top 40 country hit for the honky-tonk singer Mel Street in 1975. The next year Conway Twitty had a No. 1 country hit with Mr. Conley’s “This Time I’ve Hurt Her More Than She Loves Me.” In 1981, after an unproductive stint recording for Warner Bros. Records, Mr. Conley had his first No. 1 hit, a song he wrote called “Fire & Smoke,” released on the independent Sunbird label. In addition to Ms. Scates, Mr. Conley is survived by his brothers, Fred and Steve; his sisters, Ronda Hodges and Becky Miller; a son, Ty, and a daughter, Amy Edmisten, from his marriage to Sandra Smith, which ended in divorce; two younger daughters, Kat Scates and Erinn Scates; and five grandchildren. A versatile stylist, Mr. Conley was as much at home with the Appalachian music of his childhood as with rock- and soul-inflected arrangements. He recorded tradition-steeped duets with Emmylou Harris (“We Believe in Happy Endings”) and Keith Whitley (“Brotherly Love”). “My stuff started with bluegrass music,” Mr. Conley once explained in an interview. “That’s what inspired me, the people that came out of those hills in West Virginia and Kentucky. And, of course, Hank Williams Sr. down in Alabama. “I was born in ’41, and I was raised up on that early stuff,” he went on. “Coming out of those mountains, there’s a different soul and a different feeling and a whole different deal than what it would be like to come from the city.” "
5cacb50949f0eacbf1f81d89,https://www.nytimes.com/2019/04/09/arts/music/lil-nas-x-old-town-road.html,"A wealth of internet memes plus a viral controversy over race and the sanctity of country music have led to a distinctly 21st century No. 1 song: Lil Nas X’s “Old Town Road,” a sticky genre hybrid that has been the talk of social networks and the music industry alike for weeks. The track, which clocks in at only one minute and 53 seconds, dethroned “7 Rings” by Ariana Grande for the top spot on the industry-standard Hot 100 singles chart, Billboard announced on Monday night. The chart is determined by weighing a combination of digital streams, radio airplay and digital sales data in the United States. “Old Town Road” depended largely on streaming, totaling nearly 47 million plays — over 10 million more than its closest competitor — in the last week of chart eligibility, which ended Friday. The song was also downloaded 22,000 times and received an increase in radio play as it became a cause célèbre this month. Buzz began to grow when “Old Town Road,” which the Atlanta rapper Lil Nas X described as country-trap, arrived on three charts simultaneously: the Hot 100, Hot R&B/Hip-Hop Songs and Hot Country Songs. With silly lyrics delivered in an exaggerated drawl (“cowboy hat from Gucci/Wrangler on my booty”), the track had become an online sensation through memes on social apps like TikTok, where young people made short country-themed videos set to the song. But Billboard soon removed “Old Town Road” from the country chart, calling its initial inclusion a mistake because the song “does not embrace enough elements of today’s country music.” (The song’s beat samples an instrumental number by Nine Inch Nails, which includes a plucked banjo melody.) Many critics of the decision questioned whether race was a factor, and noted modern country’s frequent use of rapping and digital drum sounds from hip-hop. In a savvy chess move, Lil Nas X, who signed to Columbia Records amid the song’s rise, released a remix on Friday featuring the veteran country singer Billy Ray Cyrus, who argued for it to be embraced by the Nashville establishment. Billboard addressed its handling of the song in a statement on Friday, saying that the company would “continue to monitor how it is marketed and how fans respond.” It added: “Our initial decision to remove ‘Old Town Road’ from the Hot Country Songs chart could be revisited as these factors evolve.” (Because of its release date, numbers for the remix will be counted toward the position of “Old Town Road” on next week’s Billboard charts. On Tuesday, the rapper Young Thug also teased a remix.) For Lil Nas X, who turned 20 on Tuesday, the strange trip to No. 1 was well worth it. Regardless of any negativity, he posted on Twitter, “i’m going down in history.” "
